ID,Name,Description,Dataset_ID,Category,Type,Units,Source,Changes,Notes
SCCS1869,Concordance: Number of Societies within 350 Mile Radius,"Cashdan, E. (2001). Ethnic diversity and its environmental determinants: Effects of climate, pathogens, and habitat diversity. American Anthropologist, 103(4), 968-991.",SCCS,"Politics,Ecology",Continuous,number (integer),cashdan2001ethnic,,
SCCS1870,Concordance: Number of Societies within 400 Mile Radius,"Cashdan, E. (2001). Ethnic diversity and its environmental determinants: Effects of climate, pathogens, and habitat diversity. American Anthropologist, 103(4), 968-991.",SCCS,"Politics,Ecology",Continuous,number (integer),cashdan2001ethnic,,
SCCS1871,Concordance: Number of Societies within 450 Mile Radius,"Cashdan, E. (2001). Ethnic diversity and its environmental determinants: Effects of climate, pathogens, and habitat diversity. American Anthropologist, 103(4), 968-991.",SCCS,"Politics,Ecology",Continuous,number (integer),cashdan2001ethnic,,
SCCS1872,Concordance: Number of Societies within 500 Mile Radius (100 Value),"Cashdan, E. (2001). Ethnic diversity and its environmental determinants: Effects of climate, pathogens, and habitat diversity. American Anthropologist, 103(4), 968-991.",SCCS,"Politics,Ecology",Continuous,number (integer),cashdan2001ethnic,,
SCCS1874,Atlas: Number of Societies within 100 Mile Radius,"Cashdan, E. (2001). Ethnic diversity and its environmental determinants: Effects of climate, pathogens, and habitat diversity. American Anthropologist, 103(4), 968-991.",SCCS,"Politics,Ecology",Continuous,number (integer),cashdan2001ethnic,,
SCCS1875,Atlas: Number of Societies within 150 Mile Radius,"Cashdan, E. (2001). Ethnic diversity and its environmental determinants: Effects of climate, pathogens, and habitat diversity. American Anthropologist, 103(4), 968-991.",SCCS,"Politics,Ecology",Continuous,number (integer),cashdan2001ethnic,,
SCCS1876,Atlas: Number of Societies within 200 Mile Radius,"Cashdan, E. (2001). Ethnic diversity and its environmental determinants: Effects of climate, pathogens, and habitat diversity. American Anthropologist, 103(4), 968-991.",SCCS,"Politics,Ecology",Continuous,number (integer),cashdan2001ethnic,,
SCCS1877,Atlas: Number of Societies within 250 Mile Radius,"Cashdan, E. (2001). Ethnic diversity and its environmental determinants: Effects of climate, pathogens, and habitat diversity. American Anthropologist, 103(4), 968-991.",SCCS,"Politics,Ecology",Continuous,number (integer),cashdan2001ethnic,,
SCCS1878,Atlas: Number of Societies within 300 Mile Radius (100 Value),"Cashdan, E. (2001). Ethnic diversity and its environmental determinants: Effects of climate, pathogens, and habitat diversity. American Anthropologist, 103(4), 968-991.",SCCS,"Politics,Ecology",Continuous,number (integer),cashdan2001ethnic,,
SCCS1880,Atlas: Number of Societies within 350 Mile Radius (100 Value),"Cashdan, E. (2001). Ethnic diversity and its environmental determinants: Effects of climate, pathogens, and habitat diversity. American Anthropologist, 103(4), 968-991.",SCCS,"Politics,Ecology",Continuous,number (integer),cashdan2001ethnic,,
SCCS1882,Atlas: Number of Societies within 400 Mile Radius (100 Value),"Cashdan, E. (2001). Ethnic diversity and its environmental determinants: Effects of climate, pathogens, and habitat diversity. American Anthropologist, 103(4), 968-991.",SCCS,"Politics,Ecology",Continuous,number (integer),cashdan2001ethnic,,
SCCS1884,Atlas: Number of Societies within 450 Mile Radius (100 Value),"Cashdan, E. (2001). Ethnic diversity and its environmental determinants: Effects of climate, pathogens, and habitat diversity. American Anthropologist, 103(4), 968-991.",SCCS,"Politics,Ecology",Continuous,number (integer),cashdan2001ethnic,,
SCCS1886,Atlas: Number of Societies within 500 Mile Radius (100 Value),"Cashdan, E. (2001). Ethnic diversity and its environmental determinants: Effects of climate, pathogens, and habitat diversity. American Anthropologist, 103(4), 968-991.",SCCS,"Politics,Ecology",Continuous,number (integer),cashdan2001ethnic,,
SCCS1918,Crying Frequency,"Rosenblatt, P. C., Walsh, R. P., & Jackson, D. A. (2011). Grief and mourning codes. World Cultures eJournal, 18(2).",SCCS,"Life cycle,Mourning,Death,Ritual,Religion",Ordinal,,rosenblatt2011codes,,
SCCS1919,Crying Duration,"Rosenblatt, P. C., Walsh, R. P., & Jackson, D. A. (2011). Grief and mourning codes. World Cultures eJournal, 18(2).",SCCS,"Life cycle,Mourning,Death,Ritual,Religion",Ordinal,,rosenblatt2011codes,,
SCCS1920,Male Crying: Frequency,"Rosenblatt, P. C., Walsh, R. P., & Jackson, D. A. (2011). Grief and mourning codes. World Cultures eJournal, 18(2).",SCCS,"Life cycle,Mourning,Death,Ritual,Religion",Ordinal,,rosenblatt2011codes,,
SCCS1921,Female Crying: Frequency,"Rosenblatt, P. C., Walsh, R. P., & Jackson, D. A. (2011). Grief and mourning codes. World Cultures eJournal, 18(2).",SCCS,"Life cycle,Mourning,Death,Ritual,Religion",Ordinal,,rosenblatt2011codes,,
SCCS1922,Attempted Self-injury: Frequency,"Rosenblatt, P. C., Walsh, R. P., & Jackson, D. A. (2011). Grief and mourning codes. World Cultures eJournal, 18(2).",SCCS,"Life cycle,Mourning,Death,Ritual,Religion",Ordinal,,rosenblatt2011codes,,
SCCS1923,Actual Self-injury: Frequency,"Rosenblatt, P. C., Walsh, R. P., & Jackson, D. A. (2011). Grief and mourning codes. World Cultures eJournal, 18(2).",SCCS,"Life cycle,Mourning,Death,Ritual,Religion",Ordinal,,rosenblatt2011codes,,
SCCS1924,Male Attempted Self-injury: Frequency,"Rosenblatt, P. C., Walsh, R. P., & Jackson, D. A. (2011). Grief and mourning codes. World Cultures eJournal, 18(2).",SCCS,"Life cycle,Mourning,Death,Ritual,Religion",Ordinal,,rosenblatt2011codes,,
SCCS1925,Female Attempted Self-injury: Frequency,"Rosenblatt, P. C., Walsh, R. P., & Jackson, D. A. (2011). Grief and mourning codes. World Cultures eJournal, 18(2).",SCCS,"Life cycle,Mourning,Death,Ritual,Religion",Ordinal,,rosenblatt2011codes,,
SCCS1926,Male Actual Self-injury: Frequency,"Rosenblatt, P. C., Walsh, R. P., & Jackson, D. A. (2011). Grief and mourning codes. World Cultures eJournal, 18(2).",SCCS,"Life cycle,Mourning,Death,Ritual,Religion",Ordinal,,rosenblatt2011codes,,
SCCS1927,Female Actual Self-injury: Frequency,"Rosenblatt, P. C., Walsh, R. P., & Jackson, D. A. (2011). Grief and mourning codes. World Cultures eJournal, 18(2).",SCCS,"Life cycle,Mourning,Death,Ritual,Religion",Ordinal,,rosenblatt2011codes,,
SCCS1928,Institutionalized Attack by Widow of Something or Someone,"Rosenblatt, P. C., Walsh, R. P., & Jackson, D. A. (2011). Grief and mourning codes. World Cultures eJournal, 18(2).",SCCS,"Life cycle,Mourning,Death,Ritual,Religion",Ordinal,,rosenblatt2011codes,,
SCCS1929,Institutionalized Attack by Widower of Something or Someone,"Rosenblatt, P. C., Walsh, R. P., & Jackson, D. A. (2011). Grief and mourning codes. World Cultures eJournal, 18(2).",SCCS,"Life cycle,Mourning,Death,Ritual,Religion",Ordinal,,rosenblatt2011codes,,
SCCS1930,Institutionalized Attack on Self by Widow,"Rosenblatt, P. C., Walsh, R. P., & Jackson, D. A. (2011). Grief and mourning codes. World Cultures eJournal, 18(2).",SCCS,"Life cycle,Mourning,Death,Ritual,Religion",Ordinal,,rosenblatt2011codes,,
SCCS1931,Institutionalized Attack by Adult Offspring of Deceased,"Rosenblatt, P. C., Walsh, R. P., & Jackson, D. A. (2011). Grief and mourning codes. World Cultures eJournal, 18(2).",SCCS,"Life cycle,Mourning,Death,Ritual,Religion",Ordinal,,rosenblatt2011codes,,
SCCS1932,Institutionalized Self Attack by Adult Offspring of Deceased,"Rosenblatt, P. C., Walsh, R. P., & Jackson, D. A. (2011). Grief and mourning codes. World Cultures eJournal, 18(2).",SCCS,"Life cycle,Mourning,Death,Ritual,Religion",Ordinal,,rosenblatt2011codes,,
SCCS1933,Institutionalized Attack by Adult Siblings of Deceased,"Rosenblatt, P. C., Walsh, R. P., & Jackson, D. A. (2011). Grief and mourning codes. World Cultures eJournal, 18(2).",SCCS,"Life cycle,Mourning,Death,Ritual,Religion",Ordinal,,rosenblatt2011codes,,
SCCS1934,Outgroup Member Institutional Target,"Rosenblatt, P. C., Walsh, R. P., & Jackson, D. A. (2011). Grief and mourning codes. World Cultures eJournal, 18(2).",SCCS,"Life cycle,Mourning,Death,Ritual,Religion",Ordinal,,rosenblatt2011codes,,
SCCS1935,Presumed Killer Institutional Target,"Rosenblatt, P. C., Walsh, R. P., & Jackson, D. A. (2011). Grief and mourning codes. World Cultures eJournal, 18(2).",SCCS,"Life cycle,Mourning,Death,Ritual,Religion",Ordinal,,rosenblatt2011codes,,
SCCS1936,Self Institutionalized Target,"Rosenblatt, P. C., Walsh, R. P., & Jackson, D. A. (2011). Grief and mourning codes. World Cultures eJournal, 18(2).",SCCS,"Life cycle,Mourning,Death,Ritual,Religion",Ordinal,,rosenblatt2011codes,,
SCCS1937,Somebody Institutionalized Target,"Rosenblatt, P. C., Walsh, R. P., & Jackson, D. A. (2011). Grief and mourning codes. World Cultures eJournal, 18(2).",SCCS,"Life cycle,Mourning,Death,Ritual,Religion",Ordinal,,rosenblatt2011codes,,
SCCS1938,Something Institutionalized Target,"Rosenblatt, P. C., Walsh, R. P., & Jackson, D. A. (2011). Grief and mourning codes. World Cultures eJournal, 18(2).",SCCS,"Life cycle,Mourning,Death,Ritual,Religion",Ordinal,,rosenblatt2011codes,,
SCCS1939,"Something Institutionalized Target, Not a Sacrifice","Rosenblatt, P. C., Walsh, R. P., & Jackson, D. A. (2011). Grief and mourning codes. World Cultures eJournal, 18(2).",SCCS,"Life cycle,Mourning,Death,Ritual,Religion",Ordinal,,rosenblatt2011codes,,
SCCS1940,Spontaneous Aggression after Sudden Death,"Rosenblatt, P. C., Walsh, R. P., & Jackson, D. A. (2011). Grief and mourning codes. World Cultures eJournal, 18(2).",SCCS,"Life cycle,Mourning,Death,Ritual,Religion",Ordinal,,rosenblatt2011codes,,
SCCS1941,Fear of Ghost Present,"Rosenblatt, P. C., Walsh, R. P., & Jackson, D. A. (2011). Grief and mourning codes. World Cultures eJournal, 18(2).",SCCS,"Life cycle,Mourning,Death,Ritual,Religion",Ordinal,,rosenblatt2011codes,,
SCCS1942,Degree of Fear of Ghost,"Rosenblatt, P. C., Walsh, R. P., & Jackson, D. A. (2011). Grief and mourning codes. World Cultures eJournal, 18(2).",SCCS,"Life cycle,Mourning,Death,Ritual,Religion",Ordinal,,rosenblatt2011codes,,
SCCS1943,Fear of Bodies Present,"Rosenblatt, P. C., Walsh, R. P., & Jackson, D. A. (2011). Grief and mourning codes. World Cultures eJournal, 18(2).",SCCS,"Life cycle,Mourning,Death,Ritual,Religion",Ordinal,,rosenblatt2011codes,,
SCCS1944,"Sex Difference, Crying","Rosenblatt, P. C., Walsh, R. P., & Jackson, D. A. (2011). Grief and mourning codes. World Cultures eJournal, 18(2).",SCCS,"Life cycle,Mourning,Death,Ritual,Religion",Ordinal,,rosenblatt2011codes,,
SCCS1945,"Sex Difference, Attempted Self-mutilation","Rosenblatt, P. C., Walsh, R. P., & Jackson, D. A. (2011). Grief and mourning codes. World Cultures eJournal, 18(2).",SCCS,"Life cycle,Mourning,Death,Ritual,Religion",Ordinal,,rosenblatt2011codes,,
SCCS1946,"Sex Difference, Actual Self-mutilation","Rosenblatt, P. C., Walsh, R. P., & Jackson, D. A. (2011). Grief and mourning codes. World Cultures eJournal, 18(2).",SCCS,"Life cycle,Mourning,Death,Ritual,Religion",Ordinal,,rosenblatt2011codes,,
SCCS1947,"Sex Difference, Anger and Aggression","Rosenblatt, P. C., Walsh, R. P., & Jackson, D. A. (2011). Grief and mourning codes. World Cultures eJournal, 18(2).",SCCS,"Life cycle,Mourning,Death,Ritual,Religion",Ordinal,,rosenblatt2011codes,,
SCCS1948,Importance of Ritual Specialists up to and including Initial Body Disposal,"Rosenblatt, P. C., Walsh, R. P., & Jackson, D. A. (2011). Grief and mourning codes. World Cultures eJournal, 18(2).",SCCS,"Life cycle,Mourning,Death,Ritual,Religion",Ordinal,,rosenblatt2011codes,,
SCCS1949,Ritualization up to and including Initial Disposal,"Rosenblatt, P. C., Walsh, R. P., & Jackson, D. A. (2011). Grief and mourning codes. World Cultures eJournal, 18(2).",SCCS,"Life cycle,Mourning,Death,Ritual,Religion",Ordinal,,rosenblatt2011codes,,
SCCS1950,Amount of Contact by Bereaved with Corpse,"Rosenblatt, P. C., Walsh, R. P., & Jackson, D. A. (2011). Grief and mourning codes. World Cultures eJournal, 18(2).",SCCS,"Life cycle,Mourning,Death,Ritual,Religion",Ordinal,,rosenblatt2011codes,,
SCCS1951,Isolation of Widows,"Rosenblatt, P. C., Walsh, R. P., & Jackson, D. A. (2011). Grief and mourning codes. World Cultures eJournal, 18(2).",SCCS,"Life cycle,Mourning,Death,Ritual,Religion",Ordinal,,rosenblatt2011codes,,
SCCS1952,Isolation of Widowers,"Rosenblatt, P. C., Walsh, R. P., & Jackson, D. A. (2011). Grief and mourning codes. World Cultures eJournal, 18(2).",SCCS,"Life cycle,Mourning,Death,Ritual,Religion",Ordinal,,rosenblatt2011codes,,
SCCS1953,Isolation of Adult Offspring of Deceased,"Rosenblatt, P. C., Walsh, R. P., & Jackson, D. A. (2011). Grief and mourning codes. World Cultures eJournal, 18(2).",SCCS,"Life cycle,Mourning,Death,Ritual,Religion",Ordinal,,rosenblatt2011codes,,
SCCS1954,Isolation of Parent of Deceased Subadult Offspring,"Rosenblatt, P. C., Walsh, R. P., & Jackson, D. A. (2011). Grief and mourning codes. World Cultures eJournal, 18(2).",SCCS,"Life cycle,Mourning,Death,Ritual,Religion",Ordinal,,rosenblatt2011codes,,
SCCS1955,Marking of Widows,"Rosenblatt, P. C., Walsh, R. P., & Jackson, D. A. (2011). Grief and mourning codes. World Cultures eJournal, 18(2).",SCCS,"Life cycle,Mourning,Death,Ritual,Religion",Ordinal,,rosenblatt2011codes,,
SCCS1956,Marking of Widowers,"Rosenblatt, P. C., Walsh, R. P., & Jackson, D. A. (2011). Grief and mourning codes. World Cultures eJournal, 18(2).",SCCS,"Life cycle,Mourning,Death,Ritual,Religion",Ordinal,,rosenblatt2011codes,,
SCCS1957,Marking of Adult Offspring of Deceased,"Rosenblatt, P. C., Walsh, R. P., & Jackson, D. A. (2011). Grief and mourning codes. World Cultures eJournal, 18(2).",SCCS,"Life cycle,Mourning,Death,Ritual,Religion",Ordinal,,rosenblatt2011codes,,
SCCS1958,Marking of Subadult Offspring of Deceased,"Rosenblatt, P. C., Walsh, R. P., & Jackson, D. A. (2011). Grief and mourning codes. World Cultures eJournal, 18(2).",SCCS,"Life cycle,Mourning,Death,Ritual,Religion",Ordinal,,rosenblatt2011codes,,
SCCS1959,"Marking Duration, Parent of Subadult Offspring","Rosenblatt, P. C., Walsh, R. P., & Jackson, D. A. (2011). Grief and mourning codes. World Cultures eJournal, 18(2).",SCCS,"Life cycle,Mourning,Death,Ritual,Religion",Ordinal,,rosenblatt2011codes,,
SCCS1960,Ghosts Present,"Rosenblatt, P. C., Walsh, R. P., & Jackson, D. A. (2011). Grief and mourning codes. World Cultures eJournal, 18(2).",SCCS,"Life cycle,Mourning,Death,Ritual,Religion",Ordinal,,rosenblatt2011codes,,
SCCS1961,Ghosts Perceived Are of Those Best Known,"Rosenblatt, P. C., Walsh, R. P., & Jackson, D. A. (2011). Grief and mourning codes. World Cultures eJournal, 18(2).",SCCS,"Life cycle,Mourning,Death,Ritual,Religion",Ordinal,,rosenblatt2011codes,,
SCCS1962,Eventual Distance of Spirits,"Rosenblatt, P. C., Walsh, R. P., & Jackson, D. A. (2011). Grief and mourning codes. World Cultures eJournal, 18(2).",SCCS,"Life cycle,Mourning,Death,Ritual,Religion",Ordinal,,rosenblatt2011codes,,
SCCS1963,Sororate Present Vs. Absent,"Rosenblatt, P. C., Walsh, R. P., & Jackson, D. A. (2011). Grief and mourning codes. World Cultures eJournal, 18(2).",SCCS,"Life cycle,Mourning,Death,Ritual,Religion",Ordinal,,rosenblatt2011codes,,
SCCS1964,Percentage of Widow Remarrying,"Rosenblatt, P. C., Walsh, R. P., & Jackson, D. A. (2011). Grief and mourning codes. World Cultures eJournal, 18(2).",SCCS,"Life cycle,Mourning,Death,Ritual,Religion",Continuous,percent,rosenblatt2011codes,,
SCCS1965,Percentage of Widows Remarrying by Levirate,"Rosenblatt, P. C., Walsh, R. P., & Jackson, D. A. (2011). Grief and mourning codes. World Cultures eJournal, 18(2).",SCCS,"Life cycle,Mourning,Death,Ritual,Religion",Continuous,percent,rosenblatt2011codes,,
SCCS1966,Levirate Present Vs. Absent,"Rosenblatt, P. C., Walsh, R. P., & Jackson, D. A. (2011). Grief and mourning codes. World Cultures eJournal, 18(2).",SCCS,"Life cycle,Mourning,Death,Ritual,Religion",Ordinal,,rosenblatt2011codes,,
SCCS1967,Some Personal Objects of Deceased Are Disposed of with Corps or Ggiven to Other Groups or Put off Sight and Use for Substantional Amount of Time,"Rosenblatt, P. C., Walsh, R. P., & Jackson, D. A. (2011). Grief and mourning codes. World Cultures eJournal, 18(2).",SCCS,"Life cycle,Mourning,Death,Ritual,Religion",Ordinal,,rosenblatt2011codes,,
SCCS1968,Amount of Useful Property Destroyed,"Rosenblatt, P. C., Walsh, R. P., & Jackson, D. A. (2011). Grief and mourning codes. World Cultures eJournal, 18(2).",SCCS,"Life cycle,Mourning,Death,Ritual,Religion",Ordinal,,rosenblatt2011codes,,
SCCS1969,Name Taboo Present,"Rosenblatt, P. C., Walsh, R. P., & Jackson, D. A. (2011). Grief and mourning codes. World Cultures eJournal, 18(2).",SCCS,"Life cycle,Mourning,Death,Ritual,Religion",Ordinal,,rosenblatt2011codes,,
SCCS1970,Dwelling or Room of Deceased Abandoned at Least Temporarily,"Rosenblatt, P. C., Walsh, R. P., & Jackson, D. A. (2011). Grief and mourning codes. World Cultures eJournal, 18(2).",SCCS,"Life cycle,Mourning,Death,Ritual,Religion",Ordinal,,rosenblatt2011codes,,
SCCS1971,Temporary or Permanent Camp or Village Abandonment,"Rosenblatt, P. C., Walsh, R. P., & Jackson, D. A. (2011). Grief and mourning codes. World Cultures eJournal, 18(2).",SCCS,"Life cycle,Mourning,Death,Ritual,Religion",Ordinal,,rosenblatt2011codes,,
SCCS1972,"Name Taboo, If Present, Applies Primarily to Close Relatives or Behavior in Presence of Close Relatives of the Deceased","Rosenblatt, P. C., Walsh, R. P., & Jackson, D. A. (2011). Grief and mourning codes. World Cultures eJournal, 18(2).",SCCS,"Life cycle,Mourning,Death,Ritual,Religion",Ordinal,,rosenblatt2011codes,,
SCCS1973,Cleansing of Widows,"Rosenblatt, P. C., Walsh, R. P., & Jackson, D. A. (2011). Grief and mourning codes. World Cultures eJournal, 18(2).",SCCS,"Life cycle,Mourning,Death,Ritual,Religion",Ordinal,,rosenblatt2011codes,,
SCCS1974,Ghost Feared Those of People Best Known,"Rosenblatt, P. C., Walsh, R. P., & Jackson, D. A. (2011). Grief and mourning codes. World Cultures eJournal, 18(2).",SCCS,"Life cycle,Mourning,Death,Ritual,Religion",Ordinal,,rosenblatt2011codes,,
SCCS1975,"Initial Funeral Ceremonies, Attendance","Rosenblatt, P. C., Walsh, R. P., & Jackson, D. A. (2011). Grief and mourning codes. World Cultures eJournal, 18(2).",SCCS,"Life cycle,Mourning,Death,Ritual,Religion",Continuous,persons,rosenblatt2011codes,,
SCCS1976,"Final Funeral Ceremonies, Attendance","Rosenblatt, P. C., Walsh, R. P., & Jackson, D. A. (2011). Grief and mourning codes. World Cultures eJournal, 18(2).",SCCS,"Life cycle,Mourning,Death,Ritual,Religion",Continuous,persons,rosenblatt2011codes,,
SCCS1977,"Mourning: Duration, Widowers","Rosenblatt, P. C., Walsh, R. P., & Jackson, D. A. (2011). Grief and mourning codes. World Cultures eJournal, 18(2).",SCCS,"Life cycle,Mourning,Death,Ritual,Religion",Continuous,days,rosenblatt2011codes,,
SCCS1978,"Mourning: Duration, Widows","Rosenblatt, P. C., Walsh, R. P., & Jackson, D. A. (2011). Grief and mourning codes. World Cultures eJournal, 18(2).",SCCS,"Life cycle,Mourning,Death,Ritual,Religion",Continuous,days,rosenblatt2011codes,,
SCCS1979,"Mourning: Duration, Adult Offspring","Rosenblatt, P. C., Walsh, R. P., & Jackson, D. A. (2011). Grief and mourning codes. World Cultures eJournal, 18(2).",SCCS,"Life cycle,Mourning,Death,Ritual,Religion",Continuous,days,rosenblatt2011codes,,
SCCS1980,Final Ceremonies Present or Absent,"Rosenblatt, P. C., Walsh, R. P., & Jackson, D. A. (2011). Grief and mourning codes. World Cultures eJournal, 18(2).",SCCS,"Life cycle,Mourning,Death,Ritual,Religion",Ordinal,,rosenblatt2011codes,,
SCCS1981,Series of Final Ceremonies,"Rosenblatt, P. C., Walsh, R. P., & Jackson, D. A. (2011). Grief and mourning codes. World Cultures eJournal, 18(2).",SCCS,"Life cycle,Mourning,Death,Ritual,Religion",Ordinal,,rosenblatt2011codes,,
SCCS1982,Final Ceremonies Coincide with Annual Death Ceremonies,"Rosenblatt, P. C., Walsh, R. P., & Jackson, D. A. (2011). Grief and mourning codes. World Cultures eJournal, 18(2).",SCCS,"Life cycle,Mourning,Death,Ritual,Religion",Ordinal,,rosenblatt2011codes,,
SCCS1983,Final Disposal of Remains at Final Ceremony,"Rosenblatt, P. C., Walsh, R. P., & Jackson, D. A. (2011). Grief and mourning codes. World Cultures eJournal, 18(2).",SCCS,"Life cycle,Mourning,Death,Ritual,Religion",Ordinal,,rosenblatt2011codes,,
SCCS1984,Final Ceremonies Terminates Mourning,"Rosenblatt, P. C., Walsh, R. P., & Jackson, D. A. (2011). Grief and mourning codes. World Cultures eJournal, 18(2).",SCCS,"Life cycle,Mourning,Death,Ritual,Religion",Ordinal,,rosenblatt2011codes,,
SCCS1985,Amount of Grief after End of Mourning,"Rosenblatt, P. C., Walsh, R. P., & Jackson, D. A. (2011). Grief and mourning codes. World Cultures eJournal, 18(2).",SCCS,"Life cycle,Mourning,Death,Ritual,Religion",Ordinal,,rosenblatt2011codes,,
SCCS1986,Feasting at Initial Funeral Ceremonies,"Rosenblatt, P. C., Walsh, R. P., & Jackson, D. A. (2011). Grief and mourning codes. World Cultures eJournal, 18(2).",SCCS,"Life cycle,Mourning,Death,Ritual,Religion",Ordinal,,rosenblatt2011codes,,
SCCS1987,Games at Initial Funeral Ceremonies,"Rosenblatt, P. C., Walsh, R. P., & Jackson, D. A. (2011). Grief and mourning codes. World Cultures eJournal, 18(2).",SCCS,"Life cycle,Mourning,Death,Ritual,Religion",Ordinal,,rosenblatt2011codes,,
SCCS1988,Dances at Initial Funeral Ceremonies,"Rosenblatt, P. C., Walsh, R. P., & Jackson, D. A. (2011). Grief and mourning codes. World Cultures eJournal, 18(2).",SCCS,"Life cycle,Mourning,Death,Ritual,Religion",Ordinal,,rosenblatt2011codes,,
SCCS1989,Sexual Liberties at Initial Funeral Ceremonies,"Rosenblatt, P. C., Walsh, R. P., & Jackson, D. A. (2011). Grief and mourning codes. World Cultures eJournal, 18(2).",SCCS,"Life cycle,Mourning,Death,Ritual,Religion",Ordinal,,rosenblatt2011codes,,
SCCS1990,Alcohol at Initial Funeral Ceremonies,"Rosenblatt, P. C., Walsh, R. P., & Jackson, D. A. (2011). Grief and mourning codes. World Cultures eJournal, 18(2).",SCCS,"Life cycle,Mourning,Death,Ritual,Religion",Ordinal,,rosenblatt2011codes,,
SCCS1991,Feasting at Final Funeral Ceremonies,"Rosenblatt, P. C., Walsh, R. P., & Jackson, D. A. (2011). Grief and mourning codes. World Cultures eJournal, 18(2).",SCCS,"Life cycle,Mourning,Death,Ritual,Religion",Ordinal,,rosenblatt2011codes,,
SCCS1992,Games at Final Funeral Ceremonies,"Rosenblatt, P. C., Walsh, R. P., & Jackson, D. A. (2011). Grief and mourning codes. World Cultures eJournal, 18(2).",SCCS,"Life cycle,Mourning,Death,Ritual,Religion",Ordinal,,rosenblatt2011codes,,
SCCS1993,Dances at Final Funeral Ceremonies,"Rosenblatt, P. C., Walsh, R. P., & Jackson, D. A. (2011). Grief and mourning codes. World Cultures eJournal, 18(2).",SCCS,"Life cycle,Mourning,Death,Ritual,Religion",Ordinal,,rosenblatt2011codes,,
SCCS1994,Sexual Liberties at Final Funeral Ceremonies,"Rosenblatt, P. C., Walsh, R. P., & Jackson, D. A. (2011). Grief and mourning codes. World Cultures eJournal, 18(2).",SCCS,"Life cycle,Mourning,Death,Ritual,Religion",Ordinal,,rosenblatt2011codes,,
SCCS1995,Alcohol at Final Funeral Ceremonies,"Rosenblatt, P. C., Walsh, R. P., & Jackson, D. A. (2011). Grief and mourning codes. World Cultures eJournal, 18(2).",SCCS,"Life cycle,Mourning,Death,Ritual,Religion",Categorical,,rosenblatt2011codes,,
SCCS1996,Final Ceremonies Held for More than One Death at a Time,"Rosenblatt, P. C., Walsh, R. P., & Jackson, D. A. (2011). Grief and mourning codes. World Cultures eJournal, 18(2).",SCCS,"Life cycle,Mourning,Death,Ritual,Religion",Ordinal,,rosenblatt2011codes,,
SCCS1997,Degree of Christian Influence,"Rosenblatt, P. C., Walsh, R. P., & Jackson, D. A. (2011). Grief and mourning codes. World Cultures eJournal, 18(2).",SCCS,"Life cycle,Mourning,Death,Ritual,Religion",Ordinal,,rosenblatt2011codes,,
SCCS1998,Belief in Reincarnation of Deceased Adults,"Rosenblatt, P. C., Walsh, R. P., & Jackson, D. A. (2011). Grief and mourning codes. World Cultures eJournal, 18(2).",SCCS,"Life cycle,Mourning,Death,Ritual,Religion",Ordinal,,rosenblatt2011codes,,
SCCS1999,Conflict and Resentment over Property Inheritance,"Rosenblatt, P. C., Walsh, R. P., & Jackson, D. A. (2011). Grief and mourning codes. World Cultures eJournal, 18(2).",SCCS,"Life cycle,Mourning,Death,Ritual,Religion",Ordinal,,rosenblatt2011codes,,
SCCS2000,"Age of Marriage, Females (N = 35)","Rosenblatt, P. C., Walsh, R. P., & Jackson, D. A. (2011). Grief and mourning codes. World Cultures eJournal, 18(2).",SCCS,"Life cycle,Mourning,Death,Ritual,Religion",Continuous,years,rosenblatt2011codes,,
SCCS2001,Deep Islamization/Christianization (1806),"Rosenblatt, P. C., Walsh, R. P., & Jackson, D. A. (2011). Grief and mourning codes. World Cultures eJournal, 18(2).",SCCS,"Life cycle,Mourning,Death,Ritual,Religion",Categorical,,rosenblatt2011codes,,
SCCS2002,World Religions (1807),"Rosenblatt, P. C., Walsh, R. P., & Jackson, D. A. (2011). Grief and mourning codes. World Cultures eJournal, 18(2).",SCCS,"Life cycle,Mourning,Death,Ritual,Religion",Categorical,,rosenblatt2011codes,,
WNAI8,Tribal natural vegetation area,,WNAI,"Ecology: vegetation,Ecology: overview",Categorical,,"Data imported from WNAI text files wn01.dat - wn08.dat, included in folder 10#2 of World Cultures CD-ROM (2011). Codes from Jorgensen, J. G. (1999) Codebook for Western Indians Data. 1999 World Cultures 10(2): 144-293.",Tribal natural vegetation area,
