ID,Name,Description,Dataset_ID,Category,Type,Units,Source,Changes,Notes
SCCS952,Penalties for Barrenness,"Frayser, S. G. (1985). Varieties of sexual experience: An anthropological perspective on human sexuality. Human Relations Area Files.",SCCS,"Marriage,Life cycle",Categorical,,frayser1985varieties,,Ranked According to the Severity of the Penalty the Woman Incurs If She Is Barren (note source: DRW codebook)
SCCS953,Contraception: Knowledge and Use of Means to Prevent the Conception of Children,"Frayser, S. G. (1985). Varieties of sexual experience: An anthropological perspective on human sexuality. Human Relations Area Files.",SCCS,"Marriage,Life cycle",Categorical,,frayser1985varieties,,Ranked According to the Degree to Which the Responsibility for Contraception Devolves upon the Woman (note source: DRW codebook)
SCCS954,Social Approval for Abortion: Approval of and Rationale for Action Taken to Prevent the Birth of a Child by Expelling the Fetus before It Is Viable,"Frayser, S. G. (1985). Varieties of sexual experience: An anthropological perspective on human sexuality. Human Relations Area Files.",SCCS,"Marriage,Life cycle",Categorical,,frayser1985varieties,,Ranked According to the Amount of Social Disapproval towards Abortion (note source: DRW codebook)
SCCS955,Rationale for Abortions,"Frayser, S. G. (1985). Varieties of sexual experience: An anthropological perspective on human sexuality. Human Relations Area Files.",SCCS,"Marriage,Life cycle",Categorical,,frayser1985varieties,,"Ranked According to the Degree to Which Social Rather than Personal Considerations Lead to the Abortion. If There Is More than One Reason, Indicate the Most Frequent Reason First on the Code Sheet, Second, etc. up to Four Important Reasons. (note source: DRW codebook)"
SCCS956,Social Approval for Infanticide,"Frayser, S. G. (1985). Varieties of sexual experience: An anthropological perspective on human sexuality. Human Relations Area Files.",SCCS,"Marriage,Life cycle",Categorical,,frayser1985varieties,,Ranked According to the Amount of Social Disapproval Incurred If Infanticide Occurs (note source: DRW codebook)
SCCS957,Rationale for Infanticide. Each Category Indicates a Reason for Which an Infant Might Be Killed,"Frayser, S. G. (1985). Varieties of sexual experience: An anthropological perspective on human sexuality. Human Relations Area Files.",SCCS,"Marriage,Life cycle",Categorical,,frayser1985varieties,,Ranked According to the Degree to Which Social Rather than Personal Reasons Lead to the Infanticide (note source: DRW codebook)
SCCS958,Restrictions on the Occasion of Intercourse. Each Category Specifies an Occasion When Intercourse Is Proscribed or Strongly Preferred Not to Take Place,"Frayser, S. G. (1985). Varieties of sexual experience: An anthropological perspective on human sexuality. Human Relations Area Files.",SCCS,"Marriage,Life cycle",Categorical,,frayser1985varieties,,Ranked According to the Degree to Which the Occasion for Intercourse Is Tied to a Social Rather than N Individual State or Activity (note source: DRW codebook)
SCCS959,Extensions of the Incest Taboo. Each Category Specifies an Extension of the Incest Taboo beyond the Nuclear Family,"Frayser, S. G. (1985). Varieties of sexual experience: An anthropological perspective on human sexuality. Human Relations Area Files.",SCCS,"Marriage,Life cycle",Categorical,,frayser1985varieties,,Ranked According to the Degree to Which the Emphasis Is on Nonkinship Considerations. the Coding Should Indicate the Focus of the Strongest Extension of the Incest Taboo (note source: DRW codebook)
SCCS960,Violation of the Incest Taboo,"Frayser, S. G. (1985). Varieties of sexual experience: An anthropological perspective on human sexuality. Human Relations Area Files.",SCCS,"Marriage,Life cycle",Categorical,,frayser1985varieties,,Ranked According to the Extent of the Consequences of Violating the Incest Taboo (note source: DRW codebook)
SCCS961,Restrictions on Premarital Sex,"Frayser, S. G. (1985). Varieties of sexual experience: An anthropological perspective on human sexuality. Human Relations Area Files.",SCCS,"Marriage,Life cycle",Categorical,,frayser1985varieties,,Ranked According to the Degree of Prohibition against Premarital Sex (note source: DRW codebook)
SCCS962,Violation of Restrictions on Premarital Sex. Each Category Specifies the Consequences a Woman Faces If She Violates a Premarital Sex Prohibition,"Frayser, S. G. (1985). Varieties of sexual experience: An anthropological perspective on human sexuality. Human Relations Area Files.",SCCS,"Marriage,Life cycle",Categorical,,frayser1985varieties,,
SCCS963,Restrictions and Extramarital Sex,"Frayser, S. G. (1985). Varieties of sexual experience: An anthropological perspective on human sexuality. Human Relations Area Files.",SCCS,"Marriage,Life cycle",Categorical,,frayser1985varieties,,Ranked According to the Strength of the Prohibition against Extramarital Sex (note source: DRW codebook)
SCCS964,Punishment for Extramarital Sex,"Frayser, S. G. (1985). Varieties of sexual experience: An anthropological perspective on human sexuality. Human Relations Area Files.",SCCS,"Marriage,Life cycle",Categorical,,frayser1985varieties,,Ranked According to the Severity of Punishment That a Woman Receives If She Commits Adultery (note source: DRW codebook)
SCCS965,Violation: Who Is Punished for Adultery,"Frayser, S. G. (1985). Varieties of sexual experience: An anthropological perspective on human sexuality. Human Relations Area Files.",SCCS,"Marriage,Life cycle",Categorical,,frayser1985varieties,,Ranked According to the Degree to Which the Woman Is Punished (note source: DRW codebook)
SCCS966,Violation: Who Punishes Adultery,"Frayser, S. G. (1985). Varieties of sexual experience: An anthropological perspective on human sexuality. Human Relations Area Files.",SCCS,"Marriage,Life cycle",Categorical,,frayser1985varieties,,Ranked According to the Degree to Which Responsibility for Punishment of the Woman Resides with the Social Group (note source: DRW codebook)
SCCS967,Age of Woman at Establishment of Marriage: First Marriage,"Frayser, S. G. (1985). Varieties of sexual experience: An anthropological perspective on human sexuality. Human Relations Area Files.",SCCS,"Marriage,Life cycle",Categorical,,frayser1985varieties,,
SCCS968,Age of Man at Establishment of Marriage: First Marriage,"Frayser, S. G. (1985). Varieties of sexual experience: An anthropological perspective on human sexuality. Human Relations Area Files.",SCCS,"Marriage,Life cycle",Categorical,,frayser1985varieties,,
SCCS969,Choice of Spouse: Social Restrictions Which Limit an Individual's Choice of Whom He Can Marry,"Frayser, S. G. (1985). Varieties of sexual experience: An anthropological perspective on human sexuality. Human Relations Area Files.",SCCS,"Marriage,Life cycle",Categorical,,frayser1985varieties,,Ranked According to the Degree That Nonkinship Considerations Play an Important Role (note source: DRW codebook)
SCCS970,"Marriage Proposal: besides the Groom, Whose Proposal Is Regarded as Most Necessary in Initiating Marriage","Frayser, S. G. (1985). Varieties of sexual experience: An anthropological perspective on human sexuality. Human Relations Area Files.",SCCS,"Marriage,Life cycle",Categorical,,frayser1985varieties,,Ranked According to How Extensive a Group Is Involved in Initiating Marriage (note source: DRW codebook)
SCCS971,Consent to Marry: How Necessary Is the Consent of the Prospective Wife for Marriage Arrangements to Proceed,"Frayser, S. G. (1985). Varieties of sexual experience: An anthropological perspective on human sexuality. Human Relations Area Files.",SCCS,"Marriage,Life cycle",Categorical,,frayser1985varieties,,
SCCS972,Consent to Marry: How Necessary Is the Consent of the Prospective Husband for Marriage Arrangements to Proceed,"Frayser, S. G. (1985). Varieties of sexual experience: An anthropological perspective on human sexuality. Human Relations Area Files.",SCCS,"Marriage,Life cycle",Categorical,,frayser1985varieties,,
SCCS973,Degree of Marriage Celebration,"Frayser, S. G. (1985). Varieties of sexual experience: An anthropological perspective on human sexuality. Human Relations Area Files.",SCCS,"Marriage,Life cycle",Categorical,,frayser1985varieties,,
SCCS974,Type of Participants in the Wedding,"Frayser, S. G. (1985). Varieties of sexual experience: An anthropological perspective on human sexuality. Human Relations Area Files.",SCCS,"Marriage,Life cycle",Categorical,,frayser1985varieties,,Ranked According to How Extensive the Group Is (note source: DRW codebook)
SCCS975,The Rights Transferred by Women at Marriage,"Frayser, S. G. (1985). Varieties of sexual experience: An anthropological perspective on human sexuality. Human Relations Area Files.",SCCS,"Marriage,Life cycle",Categorical,,frayser1985varieties,,
SCCS976,The Rights Transferred by Men at Marriage,"Frayser, S. G. (1985). Varieties of sexual experience: An anthropological perspective on human sexuality. Human Relations Area Files.",SCCS,"Marriage,Life cycle",Categorical,,frayser1985varieties,,
SCCS977,Finality: Factors That Are Important for the Firm Establishment of a Marriage,"Frayser, S. G. (1985). Varieties of sexual experience: An anthropological perspective on human sexuality. Human Relations Area Files.",SCCS,"Marriage,Life cycle",Categorical,,frayser1985varieties,,Ranked According to the Degree to Which Its Establishment Depends on the Groom. the Code Reflects the Most Important Obligation That Must Be Met before the Marriage Is Considered Final (note source: DRW codebook)
SCCS978,Grounds for Divorce: Wife's Reasons given for Dissolving a Marriage,"Frayser, S. G. (1985). Varieties of sexual experience: An anthropological perspective on human sexuality. Human Relations Area Files.",SCCS,"Marriage,Life cycle",Categorical,,frayser1985varieties,,
SCCS979,Grounds for Divorce: Husband's Reasons given for Dissolving a Marriage,"Frayser, S. G. (1985). Varieties of sexual experience: An anthropological perspective on human sexuality. Human Relations Area Files.",SCCS,"Marriage,Life cycle",Categorical,,frayser1985varieties,,
SCCS980,Restrictions on Divorce,"Frayser, S. G. (1985). Varieties of sexual experience: An anthropological perspective on human sexuality. Human Relations Area Files.",SCCS,"Marriage,Life cycle",Categorical,,frayser1985varieties,,Ranked According to the Difficulty a Woman Has in Obtaining a Divorce (note source: DRW codebook)
SCCS981,Rights over Offspring after Divorce,"Frayser, S. G. (1985). Varieties of sexual experience: An anthropological perspective on human sexuality. Human Relations Area Files.",SCCS,"Marriage,Life cycle",Categorical,,frayser1985varieties,,Ranked According to the Degree to Which the Husband Retains Custody over the Children after a Divorce (note source: DRW codebook)
SCCS982,Remarriage after Divorce,"Frayser, S. G. (1985). Varieties of sexual experience: An anthropological perspective on human sexuality. Human Relations Area Files.",SCCS,"Marriage,Life cycle",Categorical,,frayser1985varieties,,Ranked According to How Difficult It Is to Remarry after a Divorce (note source: DRW codebook)
SCCS983,Property Exchanges after Divorce. Ranked in Order of the Amount of Financial Loss Incurred by the Wife When a Divorce Occurs,"Frayser, S. G. (1985). Varieties of sexual experience: An anthropological perspective on human sexuality. Human Relations Area Files.",SCCS,"Marriage,Life cycle",Categorical,,frayser1985varieties,,
SCCS984,Remarriage of Widows,"Frayser, S. G. (1985). Varieties of sexual experience: An anthropological perspective on human sexuality. Human Relations Area Files.",SCCS,"Marriage,Life cycle",Categorical,,frayser1985varieties,,The Categories Are Ranked in Order of the Degree of Restriction a Woman Faces to Remarry after Her Husband's Death (note source: DRW codebook)
SCCS985,Length of Time before a Widow Remarries,"Frayser, S. G. (1985). Varieties of sexual experience: An anthropological perspective on human sexuality. Human Relations Area Files.",SCCS,"Marriage,Life cycle",Ordinal,,frayser1985varieties,,
SCCS986,Importance of Mothers for Boys,"Rohner, R. P., & Rohner, E. C. (1982). Enculturative continuity and the importance of caretakers: Cross-cultural codes. Behavior Science Research, 17(1-2), 91-114.",SCCS,"Childhood,Life cycle",Ordinal,,rohner1982enculturative,,
SCCS987,Importance of Mothers for Girls,"Rohner, R. P., & Rohner, E. C. (1982). Enculturative continuity and the importance of caretakers: Cross-cultural codes. Behavior Science Research, 17(1-2), 91-114.",SCCS,"Childhood,Life cycle",Ordinal,,rohner1982enculturative,,
SCCS988,"Importance of Mothers for Both Boys and Girls, without Regard to Gender","Rohner, R. P., & Rohner, E. C. (1982). Enculturative continuity and the importance of caretakers: Cross-cultural codes. Behavior Science Research, 17(1-2), 91-114.",SCCS,"Childhood,Life cycle",Ordinal,,rohner1982enculturative,,
SCCS989,Importance of Fathers for Boys,"Rohner, R. P., & Rohner, E. C. (1982). Enculturative continuity and the importance of caretakers: Cross-cultural codes. Behavior Science Research, 17(1-2), 91-114.",SCCS,"Childhood,Life cycle",Ordinal,,rohner1982enculturative,,
SCCS990,Importance of Fathers for Girls,"Rohner, R. P., & Rohner, E. C. (1982). Enculturative continuity and the importance of caretakers: Cross-cultural codes. Behavior Science Research, 17(1-2), 91-114.",SCCS,"Childhood,Life cycle",Ordinal,,rohner1982enculturative,,
SCCS991,"Importance of Fathers for Both Boys and Girls, without Regard to Gender","Rohner, R. P., & Rohner, E. C. (1982). Enculturative continuity and the importance of caretakers: Cross-cultural codes. Behavior Science Research, 17(1-2), 91-114.",SCCS,"Childhood,Life cycle",Ordinal,,rohner1982enculturative,,
SCCS992,Importance of Others for Boys,"Rohner, R. P., & Rohner, E. C. (1982). Enculturative continuity and the importance of caretakers: Cross-cultural codes. Behavior Science Research, 17(1-2), 91-114.",SCCS,"Childhood,Life cycle",Ordinal,,rohner1982enculturative,,
SCCS993,Identification of Others for Boys,"Rohner, R. P., & Rohner, E. C. (1982). Enculturative continuity and the importance of caretakers: Cross-cultural codes. Behavior Science Research, 17(1-2), 91-114.",SCCS,"Childhood,Life cycle",Categorical,,rohner1982enculturative,,
SCCS994,Importance of Others for Girls,"Rohner, R. P., & Rohner, E. C. (1982). Enculturative continuity and the importance of caretakers: Cross-cultural codes. Behavior Science Research, 17(1-2), 91-114.",SCCS,"Childhood,Life cycle",Ordinal,,rohner1982enculturative,,
SCCS995,Identification of Others for Girls,"Rohner, R. P., & Rohner, E. C. (1982). Enculturative continuity and the importance of caretakers: Cross-cultural codes. Behavior Science Research, 17(1-2), 91-114.",SCCS,"Childhood,Life cycle",Categorical,,rohner1982enculturative,,
SCCS996,"Importance of Siblings (Usually Older Sisters) for Both Boys and Girls, without Regard to Gender","Rohner, R. P., & Rohner, E. C. (1982). Enculturative continuity and the importance of caretakers: Cross-cultural codes. Behavior Science Research, 17(1-2), 91-114.",SCCS,"Childhood,Life cycle",Ordinal,,rohner1982enculturative,,
SCCS997,"Importance of Grandparents (Usually Grandmothers) for Both Boys and Girls, without Regard to Gender","Rohner, R. P., & Rohner, E. C. (1982). Enculturative continuity and the importance of caretakers: Cross-cultural codes. Behavior Science Research, 17(1-2), 91-114.",SCCS,"Childhood,Life cycle",Ordinal,,rohner1982enculturative,,
SCCS998,"Importance of Others for Both Boys and Girls, without Regard to Gender","Rohner, R. P., & Rohner, E. C. (1982). Enculturative continuity and the importance of caretakers: Cross-cultural codes. Behavior Science Research, 17(1-2), 91-114.",SCCS,"Childhood,Life cycle",Ordinal,,rohner1982enculturative,,
SCCS999,"Identification of Others for Boys and Girls, without Regard to Gender","Rohner, R. P., & Rohner, E. C. (1982). Enculturative continuity and the importance of caretakers: Cross-cultural codes. Behavior Science Research, 17(1-2), 91-114.",SCCS,"Childhood,Life cycle",Categorical,,rohner1982enculturative,,
SCCS1000,Enculturative Continuity for Boys,"Rohner, R. P., & Rohner, E. C. (1982). Enculturative continuity and the importance of caretakers: Cross-cultural codes. Behavior Science Research, 17(1-2), 91-114.",SCCS,"Childhood,Life cycle",Ordinal,,rohner1982enculturative,,
SCCS1001,Incomplete Continuity for Boys: Age,"Rohner, R. P., & Rohner, E. C. (1982). Enculturative continuity and the importance of caretakers: Cross-cultural codes. Behavior Science Research, 17(1-2), 91-114.",SCCS,"Childhood,Life cycle",Ordinal,,rohner1982enculturative,,
SCCS1002,Enculturative Continuity for Girls,"Rohner, R. P., & Rohner, E. C. (1982). Enculturative continuity and the importance of caretakers: Cross-cultural codes. Behavior Science Research, 17(1-2), 91-114.",SCCS,"Childhood,Life cycle",Ordinal,,rohner1982enculturative,,
SCCS1003,Incomplete Continuity for Girls: Age,"Rohner, R. P., & Rohner, E. C. (1982). Enculturative continuity and the importance of caretakers: Cross-cultural codes. Behavior Science Research, 17(1-2), 91-114.",SCCS,"Childhood,Life cycle",Ordinal,,rohner1982enculturative,,
SCCS1004,Enculturative Continuity for Both Boys and Girls without Regard for Gender,"Rohner, R. P., & Rohner, E. C. (1982). Enculturative continuity and the importance of caretakers: Cross-cultural codes. Behavior Science Research, 17(1-2), 91-114.",SCCS,"Childhood,Life cycle",Ordinal,,rohner1982enculturative,,
SCCS1005,Incomplete Continuity for Both Boys and Girls without Regard for Gender: Age,"Rohner, R. P., & Rohner, E. C. (1982). Enculturative continuity and the importance of caretakers: Cross-cultural codes. Behavior Science Research, 17(1-2), 91-114.",SCCS,"Childhood,Life cycle",Ordinal,,rohner1982enculturative,,
SCCS1073,Change in 100 Years Prior to Observation,"Bradley, C., Moore, C. C., Burton, M. L., & White, D. R. (1990). A Cross?Cultural Historical Analysis of Subsistence Change. American Anthropologist, 92(2), 447-457.",SCCS,"Subsistence,Economy,Data Quality,Modernization",Categorical,,bradley1990cross,,
SCCS1074,Extent of Change in Subsistence or Supportive System,"Bradley, C., Moore, C. C., Burton, M. L., & White, D. R. (1990). A Cross?Cultural Historical Analysis of Subsistence Change. American Anthropologist, 92(2), 447-457.",SCCS,"Subsistence,Economy,Data Quality,Modernization",Ordinal,,bradley1990cross,,
SCCS1075,Agricultural Intensification: Increase in Inputs without Increasing Land Area of Food Production,"Bradley, C., Moore, C. C., Burton, M. L., & White, D. R. (1990). A Cross?Cultural Historical Analysis of Subsistence Change. American Anthropologist, 92(2), 447-457.",SCCS,"Subsistence,Economy,Data Quality,Modernization",Ordinal,,bradley1990cross,,
SCCS1076,Non-agricultural Intensification,"Bradley, C., Moore, C. C., Burton, M. L., & White, D. R. (1990). A Cross?Cultural Historical Analysis of Subsistence Change. American Anthropologist, 92(2), 447-457.",SCCS,"Subsistence,Economy,Data Quality,Modernization",Ordinal,,bradley1990cross,,
SCCS1077,New Crops,"Bradley, C., Moore, C. C., Burton, M. L., & White, D. R. (1990). A Cross?Cultural Historical Analysis of Subsistence Change. American Anthropologist, 92(2), 447-457.",SCCS,"Subsistence,Economy,Data Quality,Modernization",Ordinal,,bradley1990cross,,
SCCS1078,New Animals,"Bradley, C., Moore, C. C., Burton, M. L., & White, D. R. (1990). A Cross?Cultural Historical Analysis of Subsistence Change. American Anthropologist, 92(2), 447-457.",SCCS,"Subsistence,Economy,Data Quality,Modernization",Ordinal,,bradley1990cross,,
SCCS1079,Change in Settlement Patterns,"Bradley, C., Moore, C. C., Burton, M. L., & White, D. R. (1990). A Cross?Cultural Historical Analysis of Subsistence Change. American Anthropologist, 92(2), 447-457.",SCCS,"Subsistence,Economy,Data Quality,Modernization",Ordinal,,bradley1990cross,,
SCCS1080,Expansion of Land Utilized in Subsistence or Supportive Practices,"Bradley, C., Moore, C. C., Burton, M. L., & White, D. R. (1990). A Cross?Cultural Historical Analysis of Subsistence Change. American Anthropologist, 92(2), 447-457.",SCCS,"Subsistence,Economy,Data Quality,Modernization",Ordinal,,bradley1990cross,,
SCCS1081,Major Loss of Subsistence Mode,"Bradley, C., Moore, C. C., Burton, M. L., & White, D. R. (1990). A Cross?Cultural Historical Analysis of Subsistence Change. American Anthropologist, 92(2), 447-457.",SCCS,"Subsistence,Economy,Data Quality,Modernization",Ordinal,,bradley1990cross,,
SCCS1082,Wage Labour Introduced,"Bradley, C., Moore, C. C., Burton, M. L., & White, D. R. (1990). A Cross?Cultural Historical Analysis of Subsistence Change. American Anthropologist, 92(2), 447-457.",SCCS,"Subsistence,Economy,Data Quality,Modernization",Ordinal,,bradley1990cross,,
SCCS1083,Wage Labour Increased,"Bradley, C., Moore, C. C., Burton, M. L., & White, D. R. (1990). A Cross?Cultural Historical Analysis of Subsistence Change. American Anthropologist, 92(2), 447-457.",SCCS,"Subsistence,Economy,Data Quality,Modernization",Ordinal,,bradley1990cross,,
SCCS1084,Introduction to Trade,"Bradley, C., Moore, C. C., Burton, M. L., & White, D. R. (1990). A Cross?Cultural Historical Analysis of Subsistence Change. American Anthropologist, 92(2), 447-457.",SCCS,"Subsistence,Economy,Data Quality,Modernization",Ordinal,,bradley1990cross,,
SCCS1085,Trade Increased,"Bradley, C., Moore, C. C., Burton, M. L., & White, D. R. (1990). A Cross?Cultural Historical Analysis of Subsistence Change. American Anthropologist, 92(2), 447-457.",SCCS,"Subsistence,Economy,Data Quality,Modernization",Ordinal,,bradley1990cross,,
SCCS1116,Warfare Mortality (E&e 1983: 118),"White, D. R., & Burton, M. L. (1988). Causes of polygyny: Ecology, economy, kinship, and warfare. American Anthropologist, 90(4), 871-887.",SCCS,"Warfare,Politics",Categorical,,white1988causes,,"From ""STDS53.COD"" in WC 5#4:  ""Included here are some of the variety of codes used by Douglas White and Michael Burton (American Anthropologist 1988) as background variables in testing theories (including the role of warfare) about polygyny. Tests of ""Alternative Warfare Explanations"" (p. 881) included the use of a warfare mortality code by Ember and Ember (1983), and led to a compilation of internal and external warfare ratings by Keith Otterbein and Carol and Melvin Ember for societies in their samples that overlapped with the standard sample.  Annotations for locating the Embers' (and Otterbein's) codes are given in coding notes (STDS53.ANO).  White supplemented the codes on these variables by rating some of these same societies plus many others not rated by these other authors.  Reliabilities of the Ember's ratings were found to be high.  Sources for societies newly coded by White are listed in notes following the coded data."""
SCCS1117,"Internal Warfare (or Feuding) (E&e 1983: 178, 179, 185, 188, 304-306) (Ott: 143-49 Variable 4)","White, D. R., & Burton, M. L. (1988). Causes of polygyny: Ecology, economy, kinship, and warfare. American Anthropologist, 90(4), 871-887.",SCCS,"Warfare,Politics",Categorical,,white1988causes,,"From ""STDS53.COD"" in WC 5#4:  ""Included here are some of the variety of codes used by Douglas White and Michael Burton (American Anthropologist 1988) as background variables in testing theories (including the role of warfare) about polygyny. Tests of ""Alternative Warfare Explanations"" (p. 881) included the use of a warfare mortality code by Ember and Ember (1983), and led to a compilation of internal and external warfare ratings by Keith Otterbein and Carol and Melvin Ember for societies in their samples that overlapped with the standard sample.  Annotations for locating the Embers' (and Otterbein's) codes are given in coding notes (STDS53.ANO).  White supplemented the codes on these variables by rating some of these same societies plus many others not rated by these other authors.  Reliabilities of the Ember's ratings were found to be high.  Sources for societies newly coded by White are listed in notes following the coded data."""
SCCS1118,Pacification by Date of Observation,"White, D. R., & Burton, M. L. (1988). Causes of polygyny: Ecology, economy, kinship, and warfare. American Anthropologist, 90(4), 871-887.",SCCS,"Warfare,Politics",Categorical,,white1988causes,,"From ""STDS53.COD"" in WC 5#4:  ""Included here are some of the variety of codes used by Douglas White and Michael Burton (American Anthropologist 1988) as background variables in testing theories (including the role of warfare) about polygyny. Tests of ""Alternative Warfare Explanations"" (p. 881) included the use of a warfare mortality code by Ember and Ember (1983), and led to a compilation of internal and external warfare ratings by Keith Otterbein and Carol and Melvin Ember for societies in their samples that overlapped with the standard sample.  Annotations for locating the Embers' (and Otterbein's) codes are given in coding notes (STDS53.ANO).  White supplemented the codes on these variables by rating some of these same societies plus many others not rated by these other authors.  Reliabilities of the Ember's ratings were found to be high.  Sources for societies newly coded by White are listed in notes following the coded data."""
