ID,Name,Description,ColumnSpec,category,type,unit,source_comment,changes,comment,Contribution_ID
SCCS1665,Individual Aggression - Homicide,"Ember, C. R., & Ember, M. (1992). Warfare, aggression, and resource problems: Cross-cultural codes. Behavior Science Research, 26(1-4), 169-226.",,"Politics, Warfare",Categorical,,ember1992warfare,,"Note, codes not ordered (note source: DRW codebook)",dplace-dataset-sccs
SCCS1666,Individual Aggression - Assault,"Ember, C. R., & Ember, M. (1992). Warfare, aggression, and resource problems: Cross-cultural codes. Behavior Science Research, 26(1-4), 169-226.",,"Politics, Warfare",Categorical,,ember1992warfare,,"Note, codes not ordered (note source: DRW codebook)",dplace-dataset-sccs
SCCS1667,Individual Aggression - Theft,"Ember, C. R., & Ember, M. (1992). Warfare, aggression, and resource problems: Cross-cultural codes. Behavior Science Research, 26(1-4), 169-226.",,"Politics, Warfare",Categorical,,ember1992warfare,,"Note, codes not ordered (note source: DRW codebook)",dplace-dataset-sccs
SCCS1668,Individual Aggression - Trespass,"Ember, C. R., & Ember, M. (1992). Warfare, aggression, and resource problems: Cross-cultural codes. Behavior Science Research, 26(1-4), 169-226.",,"Politics, Warfare",Categorical,,ember1992warfare,,"Note, codes not ordered (note source: DRW codebook)",dplace-dataset-sccs
SCCS1669,Individual Aggression - Suicide (Resolved Ratings),"Ember, C. R., & Ember, M. (1992). Warfare, aggression, and resource problems: Cross-cultural codes. Behavior Science Research, 26(1-4), 169-226.",,"Politics, Warfare",Categorical,,ember1992warfare,,"Note, codes not ordered (note source: DRW codebook)",dplace-dataset-sccs
SCCS1670,Reliability of Individual Aggression Ratings-homicide (Var. 1665),"Ember, C. R., & Ember, M. (1992). Warfare, aggression, and resource problems: Cross-cultural codes. Behavior Science Research, 26(1-4), 169-226.",,"Politics, Warfare",Categorical,,ember1992warfare,,"Note, codes not ordered (note source: DRW codebook)",dplace-dataset-sccs
SCCS1671,Reliability of Individual Aggression Ratings-assault (Var. 1666),"Ember, C. R., & Ember, M. (1992). Warfare, aggression, and resource problems: Cross-cultural codes. Behavior Science Research, 26(1-4), 169-226.",,"Politics, Warfare",Categorical,,ember1992warfare,,"Note, codes not ordered (note source: DRW codebook)",dplace-dataset-sccs
SCCS1672,Reliability of Individual Aggression Ratings-theft (Var. 1667),"Ember, C. R., & Ember, M. (1992). Warfare, aggression, and resource problems: Cross-cultural codes. Behavior Science Research, 26(1-4), 169-226.",,"Politics, Warfare",Categorical,,ember1992warfare,,"Note, codes not ordered (note source: DRW codebook)",dplace-dataset-sccs
SCCS1673,Reliability of Individual Aggression Ratings-trespass (Var. 1668),"Ember, C. R., & Ember, M. (1992). Warfare, aggression, and resource problems: Cross-cultural codes. Behavior Science Research, 26(1-4), 169-226.",,"Politics, Warfare",Categorical,,ember1992warfare,,"Note, codes not ordered (note source: DRW codebook)",dplace-dataset-sccs
SCCS1674,Reliability of Individual Aggression Ratings-suicide (Var. 1669),"Ember, C. R., & Ember, M. (1992). Warfare, aggression, and resource problems: Cross-cultural codes. Behavior Science Research, 26(1-4), 169-226.",,"Politics, Warfare",Categorical,,ember1992warfare,,"Note, codes not ordered (note source: DRW codebook)",dplace-dataset-sccs
SCCS1675,Socially Organized Homicide,"Ember, C. R., & Ember, M. (1992). Warfare, aggression, and resource problems: Cross-cultural codes. Behavior Science Research, 26(1-4), 169-226.",,"Politics, Warfare",Categorical,,ember1992warfare,,"Note, codes not ordered (note source: DRW codebook)",dplace-dataset-sccs
SCCS1676,Socially Organized Assault,"Ember, C. R., & Ember, M. (1992). Warfare, aggression, and resource problems: Cross-cultural codes. Behavior Science Research, 26(1-4), 169-226.",,"Politics, Warfare",Categorical,,ember1992warfare,,"Note, codes not ordered (note source: DRW codebook)",dplace-dataset-sccs
SCCS1677,Socially Organized Theft,"Ember, C. R., & Ember, M. (1992). Warfare, aggression, and resource problems: Cross-cultural codes. Behavior Science Research, 26(1-4), 169-226.",,"Politics, Warfare",Categorical,,ember1992warfare,,"Note, codes not ordered (note source: DRW codebook)",dplace-dataset-sccs
SCCS1678,Socially Organized Trespass,"Ember, C. R., & Ember, M. (1992). Warfare, aggression, and resource problems: Cross-cultural codes. Behavior Science Research, 26(1-4), 169-226.",,"Politics, Warfare",Categorical,,ember1992warfare,,"Note, codes not ordered (note source: DRW codebook)",dplace-dataset-sccs
SCCS1679,Reliability of Socially Organized Homicide Ratings (Var. 1675),"Ember, C. R., & Ember, M. (1992). Warfare, aggression, and resource problems: Cross-cultural codes. Behavior Science Research, 26(1-4), 169-226.",,"Politics, Warfare",Categorical,,ember1992warfare,,"Note, codes not ordered (note source: DRW codebook)",dplace-dataset-sccs
SCCS1680,Reliability of Socially Organized Assault Ratings (Var. 1676),"Ember, C. R., & Ember, M. (1992). Warfare, aggression, and resource problems: Cross-cultural codes. Behavior Science Research, 26(1-4), 169-226.",,"Politics, Warfare",Categorical,,ember1992warfare,,"Note, codes not ordered (note source: DRW codebook)",dplace-dataset-sccs
SCCS1681,Reliability of Socially Organized Theft Ratings (Var. 1677),"Ember, C. R., & Ember, M. (1992). Warfare, aggression, and resource problems: Cross-cultural codes. Behavior Science Research, 26(1-4), 169-226.",,"Politics, Warfare",Categorical,,ember1992warfare,,"Note, codes not ordered (note source: DRW codebook)",dplace-dataset-sccs
SCCS1682,Reliability of Socially Organized Trespass Ratings (Var. 1678),"Ember, C. R., & Ember, M. (1992). Warfare, aggression, and resource problems: Cross-cultural codes. Behavior Science Research, 26(1-4), 169-226.",,"Politics, Warfare",Categorical,,ember1992warfare,,"Note, codes not ordered (note source: DRW codebook)",dplace-dataset-sccs
SCCS1683,Threat of Famine (Resolved Rating),"Ember, C. R., & Ember, M. (1992). Warfare, aggression, and resource problems: Cross-cultural codes. Behavior Science Research, 26(1-4), 169-226.",,"Politics, Warfare",Categorical,,ember1992warfare,,"Note, codes not ordered (note source: DRW codebook)",dplace-dataset-sccs
SCCS1684,Threat of Weather or Pest Disasters,"Ember, C. R., & Ember, M. (1992). Warfare, aggression, and resource problems: Cross-cultural codes. Behavior Science Research, 26(1-4), 169-226.",,"Politics, Warfare",Categorical,,ember1992warfare,,"Note, codes not ordered (note source: DRW codebook)",dplace-dataset-sccs
SCCS1685,Chronic Resource Problems (Resolved Ratings),"Ember, C. R., & Ember, M. (1992). Warfare, aggression, and resource problems: Cross-cultural codes. Behavior Science Research, 26(1-4), 169-226.",,"Politics, Warfare",Categorical,,ember1992warfare,,"Note, codes not ordered (note source: DRW codebook)",dplace-dataset-sccs
SCCS1686,Reliability of Threat of Famine Ratings (Var. 1683),"Ember, C. R., & Ember, M. (1992). Warfare, aggression, and resource problems: Cross-cultural codes. Behavior Science Research, 26(1-4), 169-226.",,"Politics, Warfare",Categorical,,ember1992warfare,,"Note, codes not ordered (note source: DRW codebook)",dplace-dataset-sccs
SCCS1687,Reliability of Threat of Natural and Pest Disaster Rating (Var 1684),"Ember, C. R., & Ember, M. (1992). Warfare, aggression, and resource problems: Cross-cultural codes. Behavior Science Research, 26(1-4), 169-226.",,"Politics, Warfare",Categorical,,ember1992warfare,,"Note, codes not ordered (note source: DRW codebook)",dplace-dataset-sccs
SCCS1688,Reliability of Chronic Scarcity Ratings (Var. 1685),"Ember, C. R., & Ember, M. (1992). Warfare, aggression, and resource problems: Cross-cultural codes. Behavior Science Research, 26(1-4), 169-226.",,"Politics, Warfare",Categorical,,ember1992warfare,,"Note, codes not ordered (note source: DRW codebook)",dplace-dataset-sccs
SCCS1689,Sex Ratio (Males/Females*10),"Ember, C. R., & Ember, M. (1992). Warfare, aggression, and resource problems: Cross-cultural codes. Behavior Science Research, 26(1-4), 169-226.","{""datatype"": ""decimal""}","Politics, Warfare",Continuous,ratio (males/females)*10,ember1992warfare,,,dplace-dataset-sccs
SCCS1691,Sex Ratio Unit,"Ember, C. R., & Ember, M. (1992). Warfare, aggression, and resource problems: Cross-cultural codes. Behavior Science Research, 26(1-4), 169-226.",,"Politics, Warfare",Categorical,,ember1992warfare,,"Note, codes not ordered (note source: DRW codebook)",dplace-dataset-sccs
SCCS1692,Scarification 1: Males,"Ludvico, L. R. (1994). Scarification, pathogen load and biome: Cross-cultural codes. World Cultures 9(1).",,"Ecology, Health, Ritual",Categorical,,ludvico1995scarification,,,dplace-dataset-sccs
SCCS1693,Scarification 1: Females,"Ludvico, L. R. (1994). Scarification, pathogen load and biome: Cross-cultural codes. World Cultures 9(1).",,"Ecology, Health, Ritual",Categorical,,ludvico1995scarification,,,dplace-dataset-sccs
SCCS1694,General Scarification: Males,"Ludvico, L. R. (1994). Scarification, pathogen load and biome: Cross-cultural codes. World Cultures 9(1).",,"Ecology, Health, Ritual",Categorical,,ludvico1995scarification,,,dplace-dataset-sccs
SCCS1695,General Scarification: Females,"Ludvico, L. R. (1994). Scarification, pathogen load and biome: Cross-cultural codes. World Cultures 9(1).",,"Ecology, Health, Ritual",Categorical,,ludvico1995scarification,,,dplace-dataset-sccs
SCCS1697,Pathogen: Wound Opportunistic Typhus,"Ludvico, L. R. (1994). Scarification, pathogen load and biome: Cross-cultural codes. World Cultures 9(1).",,"Ecology, Health, Ritual",Categorical,,ludvico1995scarification,,,dplace-dataset-sccs
SCCS1698,Pathogen: Wound Opportunistic Bejel,"Ludvico, L. R. (1994). Scarification, pathogen load and biome: Cross-cultural codes. World Cultures 9(1).",,"Ecology, Health, Ritual",Categorical,,ludvico1995scarification,,,dplace-dataset-sccs
SCCS1699,Pathogen: Wound Opportunistic Pinta,"Ludvico, L. R. (1994). Scarification, pathogen load and biome: Cross-cultural codes. World Cultures 9(1).",,"Ecology, Health, Ritual",Categorical,,ludvico1995scarification,,,dplace-dataset-sccs
SCCS1700,Pathogen: Wound Opportunistic Yaws,"Ludvico, L. R. (1994). Scarification, pathogen load and biome: Cross-cultural codes. World Cultures 9(1).",,"Ecology, Health, Ritual",Categorical,,ludvico1995scarification,,,dplace-dataset-sccs
SCCS1701,Pathogen: Wound Opportunistic Leprosy,"Ludvico, L. R. (1994). Scarification, pathogen load and biome: Cross-cultural codes. World Cultures 9(1).",,"Ecology, Health, Ritual",Categorical,,ludvico1995scarification,,,dplace-dataset-sccs
SCCS1702,Pathogen: Wound Opportunistic Leishmania,"Ludvico, L. R. (1994). Scarification, pathogen load and biome: Cross-cultural codes. World Cultures 9(1).",,"Ecology, Health, Ritual",Categorical,,ludvico1995scarification,,,dplace-dataset-sccs
SCCS1703,Pathogen: Wound Opportunistic Spirochetes,"Ludvico, L. R. (1994). Scarification, pathogen load and biome: Cross-cultural codes. World Cultures 9(1).",,"Ecology, Health, Ritual",Categorical,,ludvico1995scarification,,,dplace-dataset-sccs
SCCS1704,Pathogen: Tick Vector Typus,"Ludvico, L. R. (1994). Scarification, pathogen load and biome: Cross-cultural codes. World Cultures 9(1).",,"Ecology, Health, Ritual",Categorical,,ludvico1995scarification,,,dplace-dataset-sccs
SCCS1705,Pathogen: Tick Vector Spirochetes,"Ludvico, L. R. (1994). Scarification, pathogen load and biome: Cross-cultural codes. World Cultures 9(1).",,"Ecology, Health, Ritual",Categorical,,ludvico1995scarification,,,dplace-dataset-sccs
SCCS1706,Pathogen: Trypanosomas (from Ludvico Data),"Ludvico, L. R. (1994). Scarification, pathogen load and biome: Cross-cultural codes. World Cultures 9(1).",,"Ecology, Health, Ritual",Categorical,,ludvico1995scarification,,,dplace-dataset-sccs
SCCS1707,Pathogen: Malaria (from Ludvico Data),"Ludvico, L. R. (1994). Scarification, pathogen load and biome: Cross-cultural codes. World Cultures 9(1).",,"Ecology, Health, Ritual",Categorical,,ludvico1995scarification,,,dplace-dataset-sccs
SCCS1708,Pathogen: Schistosomes (from Ludvico Data),"Ludvico, L. R. (1994). Scarification, pathogen load and biome: Cross-cultural codes. World Cultures 9(1).",,"Ecology, Health, Ritual",Categorical,,ludvico1995scarification,,,dplace-dataset-sccs
SCCS1709,Pathogen: Filariae (from Ludvico Data),"Ludvico, L. R. (1994). Scarification, pathogen load and biome: Cross-cultural codes. World Cultures 9(1).",,"Ecology, Health, Ritual",Categorical,,ludvico1995scarification,,,dplace-dataset-sccs
SCCS1710,Person (S) Infants and Children Sleep With,"Divale, W. T., Abrams, N., Barzola, J., Harris, E., & Henry, F. M. (1998). Sleeping arrangements of children and adolescents: SCCS sample codes. World Cultures, 9(2), 3-12.",,"Childhood, Household, Life cycle, Marriage",Categorical,,divale1998sleeping,,,dplace-dataset-sccs
SCCS1711,Where Adolescents Sleep,"Divale, W. T., Abrams, N., Barzola, J., Harris, E., & Henry, F. M. (1998). Sleeping arrangements of children and adolescents: SCCS sample codes. World Cultures, 9(2), 3-12.",,"Childhood, Household, Life cycle, Marriage",Categorical,,divale1998sleeping,,,dplace-dataset-sccs
SCCS1712,Sex Segregation in Sleeping Areas of Children,"Divale, W. T., Abrams, N., Barzola, J., Harris, E., & Henry, F. M. (1998). Sleeping arrangements of children and adolescents: SCCS sample codes. World Cultures, 9(2), 3-12.",,"Childhood, Household, Life cycle, Marriage",Categorical,,divale1998sleeping,,,dplace-dataset-sccs
SCCS1713,Sex Segregation in Sleeping Areas of Adolescents and Teens,"Divale, W. T., Abrams, N., Barzola, J., Harris, E., & Henry, F. M. (1998). Sleeping arrangements of children and adolescents: SCCS sample codes. World Cultures, 9(2), 3-12.",,"Childhood, Household, Life cycle, Marriage",Categorical,,divale1998sleeping,,,dplace-dataset-sccs
SCCS1716,Primary Source of Subsistence,"Lang, H. (1998). CONAN: An electronic code-text data-base for cross-cultural studies. World Cultures, 9(2), 13-56.",,"Kinship, Politics, Subsistence",Categorical,,lang1998conan,,,dplace-dataset-sccs
SCCS1717,Secondary Source of Subsistence,"Lang, H. (1998). CONAN: An electronic code-text data-base for cross-cultural studies. World Cultures, 9(2), 13-56.",,"Kinship, Politics, Subsistence",Categorical,,lang1998conan,,,dplace-dataset-sccs
SCCS1718,Sharing of Food,"Lang, H. (1998). CONAN: An electronic code-text data-base for cross-cultural studies. World Cultures, 9(2), 13-56.",,"Kinship, Politics, Subsistence",Categorical,,lang1998conan,,,dplace-dataset-sccs
SCCS1719,Periodical Variation of Food Scarcity,"Lang, H. (1998). CONAN: An electronic code-text data-base for cross-cultural studies. World Cultures, 9(2), 13-56.",,"Kinship, Politics, Subsistence",Categorical,,lang1998conan,,,dplace-dataset-sccs
SCCS1720,Causes of Land Shortage,"Lang, H. (1998). CONAN: An electronic code-text data-base for cross-cultural studies. World Cultures, 9(2), 13-56.",,"Kinship, Politics, Subsistence",Categorical,,lang1998conan,,,dplace-dataset-sccs
SCCS1721,Number of Rich People (Wealthy),"Lang, H. (1998). CONAN: An electronic code-text data-base for cross-cultural studies. World Cultures, 9(2), 13-56.",,"Kinship, Politics, Subsistence",Categorical,,lang1998conan,,,dplace-dataset-sccs
SCCS1722,Sources of Wealth,"Lang, H. (1998). CONAN: An electronic code-text data-base for cross-cultural studies. World Cultures, 9(2), 13-56.",,"Kinship, Politics, Subsistence",Categorical,,lang1998conan,,,dplace-dataset-sccs
SCCS1723,Number of Poor,"Lang, H. (1998). CONAN: An electronic code-text data-base for cross-cultural studies. World Cultures, 9(2), 13-56.",,"Kinship, Politics, Subsistence",Ordinal,,lang1998conan,,,dplace-dataset-sccs
SCCS1724,Number of Dispossessed,"Lang, H. (1998). CONAN: An electronic code-text data-base for cross-cultural studies. World Cultures, 9(2), 13-56.",,"Kinship, Politics, Subsistence",Ordinal,,lang1998conan,,,dplace-dataset-sccs
SCCS1725,Possibility for Peaceful Territorial Expansion,"Lang, H. (1998). CONAN: An electronic code-text data-base for cross-cultural studies. World Cultures, 9(2), 13-56.",,"Kinship, Politics, Subsistence",Categorical,,lang1998conan,,,dplace-dataset-sccs
SCCS1726,Communality of Land,"Lang, H. (1998). CONAN: An electronic code-text data-base for cross-cultural studies. World Cultures, 9(2), 13-56.",,"Kinship, Politics, Subsistence",Ordinal,,lang1998conan,,,dplace-dataset-sccs
SCCS1727,Resource Acquisition as Motive for Violent Conflict Management,"Lang, H. (1998). CONAN: An electronic code-text data-base for cross-cultural studies. World Cultures, 9(2), 13-56.",,"Kinship, Politics, Subsistence",Ordinal,,lang1998conan,,,dplace-dataset-sccs
SCCS1728,"Rich, Poor, or Dispossessed as One Party in Violent Conflicts","Lang, H. (1998). CONAN: An electronic code-text data-base for cross-cultural studies. World Cultures, 9(2), 13-56.",,"Kinship, Politics, Subsistence",Categorical,,lang1998conan,,,dplace-dataset-sccs
SCCS1729,Presence of an Overarching Political Unit,"Lang, H. (1998). CONAN: An electronic code-text data-base for cross-cultural studies. World Cultures, 9(2), 13-56.",,"Kinship, Politics, Subsistence",Categorical,,lang1998conan,,"Note, codes not ordered (note source: DRW codebook)",dplace-dataset-sccs
SCCS1730,Administrative Integration of Local Community within Overarching Political Unit,"Lang, H. (1998). CONAN: An electronic code-text data-base for cross-cultural studies. World Cultures, 9(2), 13-56.",,"Kinship, Politics, Subsistence",Categorical,,lang1998conan,,"Note, codes not ordered (note source: DRW codebook)",dplace-dataset-sccs
SCCS1731,Power Participation of Local Elite within Overarching Political Unit,"Lang, H. (1998). CONAN: An electronic code-text data-base for cross-cultural studies. World Cultures, 9(2), 13-56.",,"Kinship, Politics, Subsistence",Categorical,,lang1998conan,,"Note, codes not ordered (note source: DRW codebook)",dplace-dataset-sccs
SCCS1732,Presence of Wage Labour,"Lang, H. (1998). CONAN: An electronic code-text data-base for cross-cultural studies. World Cultures, 9(2), 13-56.",,"Kinship, Politics, Subsistence",Categorical,,lang1998conan,,,dplace-dataset-sccs
SCCS1733,Market Exchange within Local Community,"Lang, H. (1998). CONAN: An electronic code-text data-base for cross-cultural studies. World Cultures, 9(2), 13-56.",,"Kinship, Politics, Subsistence",Ordinal,,lang1998conan,,,dplace-dataset-sccs
SCCS1734,Market Exchange outside of Local Community,"Lang, H. (1998). CONAN: An electronic code-text data-base for cross-cultural studies. World Cultures, 9(2), 13-56.",,"Kinship, Politics, Subsistence",Ordinal,,lang1998conan,,,dplace-dataset-sccs
SCCS1735,Relationship between Production for Subsistence and Production for Market Exchange,"Lang, H. (1998). CONAN: An electronic code-text data-base for cross-cultural studies. World Cultures, 9(2), 13-56.",,"Kinship, Politics, Subsistence",Ordinal,,lang1998conan,,,dplace-dataset-sccs
SCCS1736,"Tribute, Taxation, Expropriation","Lang, H. (1998). CONAN: An electronic code-text data-base for cross-cultural studies. World Cultures, 9(2), 13-56.",,"Kinship, Politics, Subsistence",Categorical,,lang1998conan,,,dplace-dataset-sccs
SCCS1737,Extent of Burden Caused by Tribute Payments or Taxation,"Lang, H. (1998). CONAN: An electronic code-text data-base for cross-cultural studies. World Cultures, 9(2), 13-56.",,"Kinship, Politics, Subsistence",Categorical,,lang1998conan,,,dplace-dataset-sccs
SCCS1738,Presence of Formal Education within Local Community,"Lang, H. (1998). CONAN: An electronic code-text data-base for cross-cultural studies. World Cultures, 9(2), 13-56.",,"Kinship, Politics, Subsistence",Ordinal,,lang1998conan,,,dplace-dataset-sccs
SCCS1739,Types of Violence against Overarching Political Institution,"Lang, H. (1998). CONAN: An electronic code-text data-base for cross-cultural studies. World Cultures, 9(2), 13-56.",,"Kinship, Politics, Subsistence",Categorical,,lang1998conan,,"Note, codes not ordered (note source: DRW codebook)",dplace-dataset-sccs
SCCS1740,Levels of Political Hierarchy,"Lang, H. (1998). CONAN: An electronic code-text data-base for cross-cultural studies. World Cultures, 9(2), 13-56.",,"Kinship, Politics, Subsistence",Ordinal,,lang1998conan,,,dplace-dataset-sccs
SCCS1741,Overarching Formal Jurisdiction within Unit of Maximal Political Authority,"Lang, H. (1998). CONAN: An electronic code-text data-base for cross-cultural studies. World Cultures, 9(2), 13-56.",,"Kinship, Politics, Subsistence",Ordinal,,lang1998conan,,,dplace-dataset-sccs
SCCS1742,Selection of Officials at the Lowest Level of Political Hierarchy,"Lang, H. (1998). CONAN: An electronic code-text data-base for cross-cultural studies. World Cultures, 9(2), 13-56.",,"Kinship, Politics, Subsistence",Categorical,,lang1998conan,,"Note, codes not ordered (note source: DRW codebook)",dplace-dataset-sccs
SCCS1743,Sanctions,"Lang, H. (1998). CONAN: An electronic code-text data-base for cross-cultural studies. World Cultures, 9(2), 13-56.",,"Kinship, Politics, Subsistence",Ordinal,,lang1998conan,,,dplace-dataset-sccs
SCCS1744,Lower Level Participation in Decision Making of the Unit of Maximal Political Authority,"Lang, H. (1998). CONAN: An electronic code-text data-base for cross-cultural studies. World Cultures, 9(2), 13-56.",,"Kinship, Politics, Subsistence",Categorical,,lang1998conan,,,dplace-dataset-sccs
SCCS1745,Religio-political Overlap,"Lang, H. (1998). CONAN: An electronic code-text data-base for cross-cultural studies. World Cultures, 9(2), 13-56.",,"Kinship, Politics, Subsistence",Categorical,,lang1998conan,,"Note, codes not ordered (note source: DRW codebook)",dplace-dataset-sccs
SCCS1746,Sources of Legitimation of Power,"Lang, H. (1998). CONAN: An electronic code-text data-base for cross-cultural studies. World Cultures, 9(2), 13-56.",,"Kinship, Politics, Subsistence",Categorical,,lang1998conan,,"Note, codes not ordered (note source: DRW codebook)",dplace-dataset-sccs
SCCS1747,Frequency of External Warfare: Unit of Maximal Political Authority,"Lang, H. (1998). CONAN: An electronic code-text data-base for cross-cultural studies. World Cultures, 9(2), 13-56.",,"Kinship, Politics, Subsistence",Ordinal,,lang1998conan,,,dplace-dataset-sccs
SCCS1748,Frequency of Internal Warfare; i.e. between Local Communities within Unit of Maximal Political Authority,"Lang, H. (1998). CONAN: An electronic code-text data-base for cross-cultural studies. World Cultures, 9(2), 13-56.",,"Kinship, Politics, Subsistence",Ordinal,,lang1998conan,,,dplace-dataset-sccs
SCCS1749,Frequency of Internal Warfare Involving Non-territorially Organized Groups within Unit of Maximal Political Authority,"Lang, H. (1998). CONAN: An electronic code-text data-base for cross-cultural studies. World Cultures, 9(2), 13-56.",,"Kinship, Politics, Subsistence",Ordinal,,lang1998conan,,,dplace-dataset-sccs
SCCS1750,Frequency of Violent Conflict between Groups within Local Communities,"Lang, H. (1998). CONAN: An electronic code-text data-base for cross-cultural studies. World Cultures, 9(2), 13-56.",,"Kinship, Politics, Subsistence",Ordinal,,lang1998conan,,,dplace-dataset-sccs
SCCS1751,Social Stratification,"Lang, H. (1998). CONAN: An electronic code-text data-base for cross-cultural studies. World Cultures, 9(2), 13-56.",,"Kinship, Politics, Subsistence",Ordinal,,lang1998conan,,,dplace-dataset-sccs
SCCS1752,Groom's Dependency on Relatives for Marriage Transactions,"Lang, H. (1998). CONAN: An electronic code-text data-base for cross-cultural studies. World Cultures, 9(2), 13-56.",,"Kinship, Politics, Subsistence",Categorical,,lang1998conan,,,dplace-dataset-sccs
SCCS1753,Depth of Unilineal Descent,"Lang, H. (1998). CONAN: An electronic code-text data-base for cross-cultural studies. World Cultures, 9(2), 13-56.",,"Kinship, Politics, Subsistence",Categorical,,lang1998conan,,"Note, codes not ordered (note source: DRW codebook)",dplace-dataset-sccs
SCCS1754,Size of Maximal Effective Kin Group,"Lang, H. (1998). CONAN: An electronic code-text data-base for cross-cultural studies. World Cultures, 9(2), 13-56.",,"Kinship, Politics, Subsistence",Categorical,,lang1998conan,,,dplace-dataset-sccs
SCCS1755,Local Distribution of Maximal Effective Kin Group,"Lang, H. (1998). CONAN: An electronic code-text data-base for cross-cultural studies. World Cultures, 9(2), 13-56.",,"Kinship, Politics, Subsistence",Categorical,,lang1998conan,,"Note, codes not ordered (note source: DRW codebook)",dplace-dataset-sccs
SCCS1756,Size of Local Community,"Lang, H. (1998). CONAN: An electronic code-text data-base for cross-cultural studies. World Cultures, 9(2), 13-56.",,"Kinship, Politics, Subsistence",Ordinal,,lang1998conan,,,dplace-dataset-sccs
SCCS1757,Frequency of Violent Conflict Involving at Least One Maximal Effective Kin Group,"Lang, H. (1998). CONAN: An electronic code-text data-base for cross-cultural studies. World Cultures, 9(2), 13-56.",,"Kinship, Politics, Subsistence",Categorical,,lang1998conan,,"Note, codes not ordered (note source: DRW codebook)",dplace-dataset-sccs
SCCS1758,Frequency of Violent Conflict Involving at Least One Local Community,"Lang, H. (1998). CONAN: An electronic code-text data-base for cross-cultural studies. World Cultures, 9(2), 13-56.",,"Kinship, Politics, Subsistence",Ordinal,,lang1998conan,,,dplace-dataset-sccs
SCCS1759,Affection during Early Childhood,"Lang, H. (1998). CONAN: An electronic code-text data-base for cross-cultural studies. World Cultures, 9(2), 13-56.",,"Kinship, Politics, Subsistence",Ordinal,,lang1998conan,,,dplace-dataset-sccs
