ID,Name,Description,ColumnSpec,category,type,unit,source_comment,changes,comment,Contribution_ID
SCCS62,Compactness of Settlement,"Murdock, G. P., & Wilson, S. F. (1972). Settlement patterns and community organization: Cross-cultural codes 3. Ethnology, 11(3), 254-295.",,"Community, Settlement",Categorical,,murdock1972settlement,,,dplace-dataset-sccs
SCCS63,Community Size,"Murdock, G. P., & Wilson, S. F. (1972). Settlement patterns and community organization: Cross-cultural codes 3. Ethnology, 11(3), 254-295.",,"Community, Settlement",Categorical,,murdock1972settlement,,,dplace-dataset-sccs
SCCS64,Population Density (from Murdock and Wilson Data),"Murdock, G. P., & Wilson, S. F. (1972). Settlement patterns and community organization: Cross-cultural codes 3. Ethnology, 11(3), 254-295.",,"Community, Settlement",Categorical,,murdock1972settlement,,,dplace-dataset-sccs
SCCS65,Types of Dwelling,"Murdock, G. P., & Wilson, S. F. (1972). Settlement patterns and community organization: Cross-cultural codes 3. Ethnology, 11(3), 254-295.",,"Community, Settlement",Categorical,,murdock1972settlement,,,dplace-dataset-sccs
SCCS66,Large or Impressive Structures,"Murdock, G. P., & Wilson, S. F. (1972). Settlement patterns and community organization: Cross-cultural codes 3. Ethnology, 11(3), 254-295.",,"Community, Settlement",Categorical,,murdock1972settlement,,,dplace-dataset-sccs
SCCS67,Household Form,"Murdock, G. P., & Wilson, S. F. (1972). Settlement patterns and community organization: Cross-cultural codes 3. Ethnology, 11(3), 254-295.",,"Community, Settlement",Categorical,,murdock1972settlement,,,dplace-dataset-sccs
SCCS68,"Form of Family (See 79, 80)","Murdock, G. P., & Wilson, S. F. (1972). Settlement patterns and community organization: Cross-cultural codes 3. Ethnology, 11(3), 254-295.",,"Community, Settlement",Categorical,,murdock1972settlement,,,dplace-dataset-sccs
SCCS69,Marital Residence,"Murdock, G. P., & Wilson, S. F. (1972). Settlement patterns and community organization: Cross-cultural codes 3. Ethnology, 11(3), 254-295.",,"Community, Settlement",Categorical,,murdock1972settlement,,,dplace-dataset-sccs
SCCS70,Descent - Membership in Corporate Kinship Groups,"Murdock, G. P., & Wilson, S. F. (1972). Settlement patterns and community organization: Cross-cultural codes 3. Ethnology, 11(3), 254-295.",,"Community, Settlement",Categorical,,murdock1972settlement,,,dplace-dataset-sccs
SCCS71,"Descent Groups, Location of Core Gender Group","Murdock, G. P., & Wilson, S. F. (1972). Settlement patterns and community organization: Cross-cultural codes 3. Ethnology, 11(3), 254-295.",,"Community, Settlement",Categorical,,murdock1972settlement,,,dplace-dataset-sccs
SCCS72,Intercommunity Marriage,"Murdock, G. P., & Wilson, S. F. (1972). Settlement patterns and community organization: Cross-cultural codes 3. Ethnology, 11(3), 254-295.",,"Community, Settlement",Categorical,,murdock1972settlement,,,dplace-dataset-sccs
SCCS73,Community Integration,"Murdock, G. P., & Wilson, S. F. (1972). Settlement patterns and community organization: Cross-cultural codes 3. Ethnology, 11(3), 254-295.",,"Community, Settlement",Categorical,,murdock1972settlement,,,dplace-dataset-sccs
SCCS74,Prominent Community Ceremonials,"Murdock, G. P., & Wilson, S. F. (1972). Settlement patterns and community organization: Cross-cultural codes 3. Ethnology, 11(3), 254-295.",,"Community, Settlement",Categorical,,murdock1972settlement,,,dplace-dataset-sccs
SCCS75,Ceremonial Elements,"Murdock, G. P., & Wilson, S. F. (1972). Settlement patterns and community organization: Cross-cultural codes 3. Ethnology, 11(3), 254-295.",,"Community, Settlement",Categorical,,murdock1972settlement,,,dplace-dataset-sccs
SCCS76,Community Leadership,"Murdock, G. P., & Wilson, S. F. (1972). Settlement patterns and community organization: Cross-cultural codes 3. Ethnology, 11(3), 254-295.",,"Community, Settlement",Categorical,,murdock1972settlement,,,dplace-dataset-sccs
SCCS77,"Local Political Succession, Primary","Murdock, G. P., & Wilson, S. F. (1972). Settlement patterns and community organization: Cross-cultural codes 3. Ethnology, 11(3), 254-295.",,"Community, Settlement",Categorical,,murdock1972settlement,,,dplace-dataset-sccs
SCCS78,"Local Political Succession, Secondary","Murdock, G. P., & Wilson, S. F. (1972). Settlement patterns and community organization: Cross-cultural codes 3. Ethnology, 11(3), 254-295.",,"Community, Settlement",Categorical,,murdock1972settlement,,,dplace-dataset-sccs
SCCS79,Polygamy,"Murdock, G. P., & Wilson, S. F. (1972). Settlement patterns and community organization: Cross-cultural codes 3. Ethnology, 11(3), 254-295.",,"Community, Settlement",Categorical,,murdock1972settlement,,,dplace-dataset-sccs
SCCS80,Family Size,"Murdock, G. P., & Wilson, S. F. (1972). Settlement patterns and community organization: Cross-cultural codes 3. Ethnology, 11(3), 254-295.",,"Community, Settlement",Categorical,,murdock1972settlement,,,dplace-dataset-sccs
SCCS81,Political Autonomy,"Tuden, A., & Marshall, C. (1972). Political organization: Cross-cultural codes 4. Ethnology, 11(4), 436-464.",,Politics,Categorical,,tuden1972political,,,dplace-dataset-sccs
SCCS82,Trend in Autonomy,"Tuden, A., & Marshall, C. (1972). Political organization: Cross-cultural codes 4. Ethnology, 11(4), 436-464.",,Politics,Categorical,,tuden1972political,,,dplace-dataset-sccs
SCCS83,Levels of Sovereignty,"Tuden, A., & Marshall, C. (1972). Political organization: Cross-cultural codes 4. Ethnology, 11(4), 436-464.",,Politics,Categorical,,tuden1972political,,,dplace-dataset-sccs
SCCS84,Higher Political Organization,"Tuden, A., & Marshall, C. (1972). Political organization: Cross-cultural codes 4. Ethnology, 11(4), 436-464.",,Politics,Categorical,,tuden1972political,,,dplace-dataset-sccs
SCCS85,Executive,"Tuden, A., & Marshall, C. (1972). Political organization: Cross-cultural codes 4. Ethnology, 11(4), 436-464.",,Politics,Categorical,,tuden1972political,,,dplace-dataset-sccs
SCCS86,Selection of Executive,"Tuden, A., & Marshall, C. (1972). Political organization: Cross-cultural codes 4. Ethnology, 11(4), 436-464.",,Politics,Categorical,,tuden1972political,,,dplace-dataset-sccs
SCCS87,Deliberative and Consultative Bodies,"Tuden, A., & Marshall, C. (1972). Political organization: Cross-cultural codes 4. Ethnology, 11(4), 436-464.",,Politics,Categorical,,tuden1972political,,,dplace-dataset-sccs
SCCS88,Advisory Bodies,"Tuden, A., & Marshall, C. (1972). Political organization: Cross-cultural codes 4. Ethnology, 11(4), 436-464.",,Politics,Categorical,,tuden1972political,,,dplace-dataset-sccs
SCCS89,Judiciary,"Tuden, A., & Marshall, C. (1972). Political organization: Cross-cultural codes 4. Ethnology, 11(4), 436-464.",,Politics,Categorical,,tuden1972political,,,dplace-dataset-sccs
SCCS90,Police,"Tuden, A., & Marshall, C. (1972). Political organization: Cross-cultural codes 4. Ethnology, 11(4), 436-464.",,Politics,Categorical,,tuden1972political,,,dplace-dataset-sccs
SCCS91,Administrative Hierarchy,"Tuden, A., & Marshall, C. (1972). Political organization: Cross-cultural codes 4. Ethnology, 11(4), 436-464.",,Politics,Categorical,,tuden1972political,,,dplace-dataset-sccs
SCCS92,Selection of Subordinate Officials,"Tuden, A., & Marshall, C. (1972). Political organization: Cross-cultural codes 4. Ethnology, 11(4), 436-464.",,Politics,Categorical,,tuden1972political,,,dplace-dataset-sccs
SCCS93,Political Power - Most Important Source,"Tuden, A., & Marshall, C. (1972). Political organization: Cross-cultural codes 4. Ethnology, 11(4), 436-464.",,Politics,Categorical,,tuden1972political,,,dplace-dataset-sccs
SCCS94,Political Power - Second Most Important Source,"Tuden, A., & Marshall, C. (1972). Political organization: Cross-cultural codes 4. Ethnology, 11(4), 436-464.",,Politics,Categorical,,tuden1972political,,,dplace-dataset-sccs
SCCS95,Political Power - Third Most Important Source,"Tuden, A., & Marshall, C. (1972). Political organization: Cross-cultural codes 4. Ethnology, 11(4), 436-464.",,Politics,Categorical,,tuden1972political,,,dplace-dataset-sccs
SCCS96,Political Power - Fourth Most Important Source,"Tuden, A., & Marshall, C. (1972). Political organization: Cross-cultural codes 4. Ethnology, 11(4), 436-464.",,Politics,Categorical,,tuden1972political,,,dplace-dataset-sccs
SCCS97,Political Power - Fifth Most Important Source,"Tuden, A., & Marshall, C. (1972). Political organization: Cross-cultural codes 4. Ethnology, 11(4), 436-464.",,Politics,Categorical,,tuden1972political,,,dplace-dataset-sccs
SCCS98,Political Power - Sixth Most Important Source,"Tuden, A., & Marshall, C. (1972). Political organization: Cross-cultural codes 4. Ethnology, 11(4), 436-464.",,Politics,Categorical,,tuden1972political,,,dplace-dataset-sccs
SCCS99,Food Collection: Vegetal (sexual division of labor),"Murdock, G. P., & Provost, C. (1973). Factors in the division of labor by sex: A cross-cultural analysis. Ethnology, 12(2), 203-225.",,"Economy, Labour",Categorical,,murdock1973factors,,,dplace-dataset-sccs
SCCS100,"Food Collection: Eggs, Insects, and/or Small Land Fauna (sexual division of labor)","Murdock, G. P., & Provost, C. (1973). Factors in the division of labor by sex: A cross-cultural analysis. Ethnology, 12(2), 203-225.",,"Economy, Labour",Categorical,,murdock1973factors,,,dplace-dataset-sccs
SCCS101,Food Collection: Shellfish/Small Aquatic Fauna (sexual division of labor),"Murdock, G. P., & Provost, C. (1973). Factors in the division of labor by sex: A cross-cultural analysis. Ethnology, 12(2), 203-225.",,"Economy, Labour",Categorical,,murdock1973factors,,,dplace-dataset-sccs
SCCS102,Food Collection: Honey (sexual division of labor),"Murdock, G. P., & Provost, C. (1973). Factors in the division of labor by sex: A cross-cultural analysis. Ethnology, 12(2), 203-225.",,"Economy, Labour",Categorical,,murdock1973factors,,,dplace-dataset-sccs
SCCS103,Food Collection: Fowling (sexual division of labor),"Murdock, G. P., & Provost, C. (1973). Factors in the division of labor by sex: A cross-cultural analysis. Ethnology, 12(2), 203-225.",,"Economy, Labour",Categorical,,murdock1973factors,,,dplace-dataset-sccs
SCCS104,Food Collection: Fishing (sexual division of labor),"Murdock, G. P., & Provost, C. (1973). Factors in the division of labor by sex: A cross-cultural analysis. Ethnology, 12(2), 203-225.",,"Economy, Labour",Categorical,,murdock1973factors,,,dplace-dataset-sccs
SCCS105,Food Collection: Trapping (sexual division of labor),"Murdock, G. P., & Provost, C. (1973). Factors in the division of labor by sex: A cross-cultural analysis. Ethnology, 12(2), 203-225.",,"Economy, Labour",Categorical,,murdock1973factors,,,dplace-dataset-sccs
SCCS106,Food Collection: Large Land Fauna (sexual division of labor),"Murdock, G. P., & Provost, C. (1973). Factors in the division of labor by sex: A cross-cultural analysis. Ethnology, 12(2), 203-225.",,"Economy, Labour",Categorical,,murdock1973factors,,,dplace-dataset-sccs
SCCS107,Food Collection: Large Aquatic Fauna (sexual division of labor),"Murdock, G. P., & Provost, C. (1973). Factors in the division of labor by sex: A cross-cultural analysis. Ethnology, 12(2), 203-225.",,"Economy, Labour",Categorical,,murdock1973factors,,,dplace-dataset-sccs
SCCS108,Food Production: Land Clearance (sexual division of labor),"Murdock, G. P., & Provost, C. (1973). Factors in the division of labor by sex: A cross-cultural analysis. Ethnology, 12(2), 203-225.",,"Economy, Labour",Categorical,,murdock1973factors,,,dplace-dataset-sccs
SCCS109,Food Production: Soil Preparation (sexual division of labor),"Murdock, G. P., & Provost, C. (1973). Factors in the division of labor by sex: A cross-cultural analysis. Ethnology, 12(2), 203-225.",,"Economy, Labour",Categorical,,murdock1973factors,,,dplace-dataset-sccs
SCCS110,Food Production: Planting (sexual division of labor),"Murdock, G. P., & Provost, C. (1973). Factors in the division of labor by sex: A cross-cultural analysis. Ethnology, 12(2), 203-225.",,"Economy, Labour",Categorical,,murdock1973factors,,,dplace-dataset-sccs
SCCS111,Food Production: Crop Tending (sexual division of labor),"Murdock, G. P., & Provost, C. (1973). Factors in the division of labor by sex: A cross-cultural analysis. Ethnology, 12(2), 203-225.",,"Economy, Labour",Categorical,,murdock1973factors,,,dplace-dataset-sccs
SCCS112,Food Production: Harvesting (sexual division of labor),"Murdock, G. P., & Provost, C. (1973). Factors in the division of labor by sex: A cross-cultural analysis. Ethnology, 12(2), 203-225.",,"Economy, Labour",Categorical,,murdock1973factors,,,dplace-dataset-sccs
SCCS113,Food Production: Small Domestic Animals (sexual division of labor),"Murdock, G. P., & Provost, C. (1973). Factors in the division of labor by sex: A cross-cultural analysis. Ethnology, 12(2), 203-225.",,"Economy, Labour",Categorical,,murdock1973factors,,,dplace-dataset-sccs
SCCS114,Food Production: Large Domestic Animals (sexual division of labor),"Murdock, G. P., & Provost, C. (1973). Factors in the division of labor by sex: A cross-cultural analysis. Ethnology, 12(2), 203-225.",,"Economy, Labour",Categorical,,murdock1973factors,,,dplace-dataset-sccs
SCCS115,Food Production: Milking (sexual division of labor),"Murdock, G. P., & Provost, C. (1973). Factors in the division of labor by sex: A cross-cultural analysis. Ethnology, 12(2), 203-225.",,"Economy, Labour",Categorical,,murdock1973factors,,,dplace-dataset-sccs
SCCS116,Food Preparation: Vegetal: Food Preparation (sexual division of labor),"Murdock, G. P., & Provost, C. (1973). Factors in the division of labor by sex: A cross-cultural analysis. Ethnology, 12(2), 203-225.",,"Economy, Labour",Categorical,,murdock1973factors,,,dplace-dataset-sccs
SCCS117,Food Preparation: Butchering (sexual division of labor),"Murdock, G. P., & Provost, C. (1973). Factors in the division of labor by sex: A cross-cultural analysis. Ethnology, 12(2), 203-225.",,"Economy, Labour",Categorical,,murdock1973factors,,,dplace-dataset-sccs
SCCS118,Food Preparation: Preservation (sexual division of labor),"Murdock, G. P., & Provost, C. (1973). Factors in the division of labor by sex: A cross-cultural analysis. Ethnology, 12(2), 203-225.",,"Economy, Labour",Categorical,,murdock1973factors,,,dplace-dataset-sccs
SCCS119,Food Preparation: Drinks (sexual division of labor),"Murdock, G. P., & Provost, C. (1973). Factors in the division of labor by sex: A cross-cultural analysis. Ethnology, 12(2), 203-225.",,"Economy, Labour",Categorical,,murdock1973factors,,,dplace-dataset-sccs
SCCS120,Food Preparation: Dairy (sexual division of labor),"Murdock, G. P., & Provost, C. (1973). Factors in the division of labor by sex: A cross-cultural analysis. Ethnology, 12(2), 203-225.",,"Economy, Labour",Categorical,,murdock1973factors,,,dplace-dataset-sccs
SCCS121,Food Preparation: Cooking (sexual division of labor),"Murdock, G. P., & Provost, C. (1973). Factors in the division of labor by sex: A cross-cultural analysis. Ethnology, 12(2), 203-225.",,"Economy, Labour",Categorical,,murdock1973factors,,,dplace-dataset-sccs
SCCS122,Extractive Industries: Mining/Quarrying (sexual division of labor),"Murdock, G. P., & Provost, C. (1973). Factors in the division of labor by sex: A cross-cultural analysis. Ethnology, 12(2), 203-225.",,"Economy, Labour",Categorical,,murdock1973factors,,,dplace-dataset-sccs
SCCS123,Extractive Industries: Fuel Gathering (sexual division of labor),"Murdock, G. P., & Provost, C. (1973). Factors in the division of labor by sex: A cross-cultural analysis. Ethnology, 12(2), 203-225.",,"Economy, Labour",Categorical,,murdock1973factors,,,dplace-dataset-sccs
SCCS124,Extractive Industries: Lumbering (sexual division of labor),"Murdock, G. P., & Provost, C. (1973). Factors in the division of labor by sex: A cross-cultural analysis. Ethnology, 12(2), 203-225.",,"Economy, Labour",Categorical,,murdock1973factors,,,dplace-dataset-sccs
SCCS125,Extractive Industries: Water Fetching (sexual division of labor),"Murdock, G. P., & Provost, C. (1973). Factors in the division of labor by sex: A cross-cultural analysis. Ethnology, 12(2), 203-225.",,"Economy, Labour",Categorical,,murdock1973factors,,,dplace-dataset-sccs
SCCS126,Intermediate Processing: Skins (sexual division of labor),"Murdock, G. P., & Provost, C. (1973). Factors in the division of labor by sex: A cross-cultural analysis. Ethnology, 12(2), 203-225.",,"Economy, Labour",Categorical,,murdock1973factors,,,dplace-dataset-sccs
SCCS127,Intermediate Processing: Spinning (sexual division of labor),"Murdock, G. P., & Provost, C. (1973). Factors in the division of labor by sex: A cross-cultural analysis. Ethnology, 12(2), 203-225.",,"Economy, Labour",Categorical,,murdock1973factors,,,dplace-dataset-sccs
SCCS128,Intermediate Processing: Loom Weaving (sexual division of labor),"Murdock, G. P., & Provost, C. (1973). Factors in the division of labor by sex: A cross-cultural analysis. Ethnology, 12(2), 203-225.",,"Economy, Labour",Categorical,,murdock1973factors,,,dplace-dataset-sccs
SCCS129,Intermediate Processing: Smelting (sexual division of labor),"Murdock, G. P., & Provost, C. (1973). Factors in the division of labor by sex: A cross-cultural analysis. Ethnology, 12(2), 203-225.",,"Economy, Labour",Categorical,,murdock1973factors,,,dplace-dataset-sccs
SCCS130,Manufacturing: Matmaking (sexual division of labor),"Murdock, G. P., & Provost, C. (1973). Factors in the division of labor by sex: A cross-cultural analysis. Ethnology, 12(2), 203-225.",,"Economy, Labour",Categorical,,murdock1973factors,,,dplace-dataset-sccs
SCCS131,Manufacturing: Netmaking (sexual division of labor),"Murdock, G. P., & Provost, C. (1973). Factors in the division of labor by sex: A cross-cultural analysis. Ethnology, 12(2), 203-225.",,"Economy, Labour",Categorical,,murdock1973factors,,,dplace-dataset-sccs
SCCS132,Manufacturing: Basketmaking (sexual division of labor),"Murdock, G. P., & Provost, C. (1973). Factors in the division of labor by sex: A cross-cultural analysis. Ethnology, 12(2), 203-225.",,"Economy, Labour",Categorical,,murdock1973factors,,,dplace-dataset-sccs
SCCS133,Manufacturing: Rope or Cordage (sexual division of labor),"Murdock, G. P., & Provost, C. (1973). Factors in the division of labor by sex: A cross-cultural analysis. Ethnology, 12(2), 203-225.",,"Economy, Labour",Categorical,,murdock1973factors,,,dplace-dataset-sccs
SCCS134,Manufacturing: Leather (sexual division of labor),"Murdock, G. P., & Provost, C. (1973). Factors in the division of labor by sex: A cross-cultural analysis. Ethnology, 12(2), 203-225.",,"Economy, Labour",Categorical,,murdock1973factors,,,dplace-dataset-sccs
SCCS135,Manufacturing: Clothing (sexual division of labor),"Murdock, G. P., & Provost, C. (1973). Factors in the division of labor by sex: A cross-cultural analysis. Ethnology, 12(2), 203-225.",,"Economy, Labour",Categorical,,murdock1973factors,,,dplace-dataset-sccs
SCCS136,Manufacturing: Pottery (sexual division of labor),"Murdock, G. P., & Provost, C. (1973). Factors in the division of labor by sex: A cross-cultural analysis. Ethnology, 12(2), 203-225.",,"Economy, Labour",Categorical,,murdock1973factors,,,dplace-dataset-sccs
SCCS137,Manufacturing: Wood (sexual division of labor),"Murdock, G. P., & Provost, C. (1973). Factors in the division of labor by sex: A cross-cultural analysis. Ethnology, 12(2), 203-225.",,"Economy, Labour",Categorical,,murdock1973factors,,,dplace-dataset-sccs
SCCS138,Manufacturing: Bone (sexual division of labor),"Murdock, G. P., & Provost, C. (1973). Factors in the division of labor by sex: A cross-cultural analysis. Ethnology, 12(2), 203-225.",,"Economy, Labour",Categorical,,murdock1973factors,,,dplace-dataset-sccs
SCCS139,Manufacturing: Stone (sexual division of labor),"Murdock, G. P., & Provost, C. (1973). Factors in the division of labor by sex: A cross-cultural analysis. Ethnology, 12(2), 203-225.",,"Economy, Labour",Categorical,,murdock1973factors,,,dplace-dataset-sccs
SCCS140,Manufacturing: Metal (sexual division of labor),"Murdock, G. P., & Provost, C. (1973). Factors in the division of labor by sex: A cross-cultural analysis. Ethnology, 12(2), 203-225.",,"Economy, Labour",Categorical,,murdock1973factors,,,dplace-dataset-sccs
SCCS141,Manufacturing: Musical Instruments (sexual division of labor),"Murdock, G. P., & Provost, C. (1973). Factors in the division of labor by sex: A cross-cultural analysis. Ethnology, 12(2), 203-225.",,"Economy, Labour",Categorical,,murdock1973factors,,,dplace-dataset-sccs
SCCS142,Miscellaneous: Fire (sexual division of labor),"Murdock, G. P., & Provost, C. (1973). Factors in the division of labor by sex: A cross-cultural analysis. Ethnology, 12(2), 203-225.",,"Economy, Labour",Categorical,,murdock1973factors,,,dplace-dataset-sccs
SCCS143,Miscellaneous: Laundering (sexual division of labor),"Murdock, G. P., & Provost, C. (1973). Factors in the division of labor by sex: A cross-cultural analysis. Ethnology, 12(2), 203-225.",,"Economy, Labour",Categorical,,murdock1973factors,,,dplace-dataset-sccs
SCCS144,Miscellaneous: Bodily Mutilation (sexual division of labor),"Murdock, G. P., & Provost, C. (1973). Factors in the division of labor by sex: A cross-cultural analysis. Ethnology, 12(2), 203-225.",,"Economy, Labour",Categorical,,murdock1973factors,,,dplace-dataset-sccs
SCCS145,Miscellaneous: Bonesetting/Surgery (sexual division of labor),"Murdock, G. P., & Provost, C. (1973). Factors in the division of labor by sex: A cross-cultural analysis. Ethnology, 12(2), 203-225.",,"Economy, Labour",Categorical,,murdock1973factors,,,dplace-dataset-sccs
SCCS146,Miscellaneous: Burden Carrying (sexual division of labor),"Murdock, G. P., & Provost, C. (1973). Factors in the division of labor by sex: A cross-cultural analysis. Ethnology, 12(2), 203-225.",,"Economy, Labour",Categorical,,murdock1973factors,,,dplace-dataset-sccs
SCCS147,Miscellaneous: Boatbuilding (sexual division of labor),"Murdock, G. P., & Provost, C. (1973). Factors in the division of labor by sex: A cross-cultural analysis. Ethnology, 12(2), 203-225.",,"Economy, Labour",Categorical,,murdock1973factors,,,dplace-dataset-sccs
SCCS148,Miscellaneous: Housebuilding (sexual division of labor),"Murdock, G. P., & Provost, C. (1973). Factors in the division of labor by sex: A cross-cultural analysis. Ethnology, 12(2), 203-225.",,"Economy, Labour",Categorical,,murdock1973factors,,,dplace-dataset-sccs
SCCS149,Scale 1- Writing and Records,"Murdock, G. P., & Provost, C. (1973). Measurement of cultural complexity. Ethnology, 12(4), 379-392.",,"Economy, Modernization",Ordinal,,murdock1973measurement,,,dplace-dataset-sccs
SCCS150,Scale 2- Fixity of Residence,"Murdock, G. P., & Provost, C. (1973). Measurement of cultural complexity. Ethnology, 12(4), 379-392.",,"Economy, Modernization",Ordinal,,murdock1973measurement,,,dplace-dataset-sccs
SCCS151,Scale 3- Agriculture,"Murdock, G. P., & Provost, C. (1973). Measurement of cultural complexity. Ethnology, 12(4), 379-392.",,"Economy, Modernization",Ordinal,,murdock1973measurement,,,dplace-dataset-sccs
SCCS152,Scale 4- Urbanization,"Murdock, G. P., & Provost, C. (1973). Measurement of cultural complexity. Ethnology, 12(4), 379-392.",,"Economy, Modernization",Ordinal,,murdock1973measurement,,,dplace-dataset-sccs
SCCS153,Scale 5- Technological Specialization,"Murdock, G. P., & Provost, C. (1973). Measurement of cultural complexity. Ethnology, 12(4), 379-392.",,"Economy, Modernization",Ordinal,,murdock1973measurement,,,dplace-dataset-sccs
SCCS154,Scale 6- Land Transport,"Murdock, G. P., & Provost, C. (1973). Measurement of cultural complexity. Ethnology, 12(4), 379-392.",,"Economy, Modernization",Ordinal,,murdock1973measurement,,,dplace-dataset-sccs
SCCS155,Scale 7- Money,"Murdock, G. P., & Provost, C. (1973). Measurement of cultural complexity. Ethnology, 12(4), 379-392.",,"Economy, Modernization",Ordinal,,murdock1973measurement,,,dplace-dataset-sccs
SCCS156,Scale 8- Density of Population,"Murdock, G. P., & Provost, C. (1973). Measurement of cultural complexity. Ethnology, 12(4), 379-392.",,"Economy, Modernization",Ordinal,,murdock1973measurement,,,dplace-dataset-sccs
SCCS157,Scale 9- Political Integration,"Murdock, G. P., & Provost, C. (1973). Measurement of cultural complexity. Ethnology, 12(4), 379-392.",,"Economy, Modernization",Ordinal,,murdock1973measurement,,,dplace-dataset-sccs
SCCS158,Scale 10- Social Stratification,"Murdock, G. P., & Provost, C. (1973). Measurement of cultural complexity. Ethnology, 12(4), 379-392.",,"Economy, Modernization",Ordinal,,murdock1973measurement,,,dplace-dataset-sccs
SCCS159,Talk about Sex,"Broude, G. J., & Greene, S. J. (1976). Cross-cultural codes on twenty sexual attitudes and practices. Ethnology, 15(4), 409-429.",,"Life cycle, Marriage, Sexual practices",Ordinal,,broude1976cross,,,dplace-dataset-sccs
SCCS160,Sex Frequency in Marriage,"Broude, G. J., & Greene, S. J. (1976). Cross-cultural codes on twenty sexual attitudes and practices. Ethnology, 15(4), 409-429.",,"Life cycle, Marriage, Sexual practices",Ordinal,,broude1976cross,,,dplace-dataset-sccs
SCCS161,Sex Believed Dangerous,"Broude, G. J., & Greene, S. J. (1976). Cross-cultural codes on twenty sexual attitudes and practices. Ethnology, 15(4), 409-429.",,"Life cycle, Marriage, Sexual practices",Ordinal,,broude1976cross,,,dplace-dataset-sccs
SCCS162,Foreplay,"Broude, G. J., & Greene, S. J. (1976). Cross-cultural codes on twenty sexual attitudes and practices. Ethnology, 15(4), 409-429.",,"Life cycle, Marriage, Sexual practices",Ordinal,,broude1976cross,,,dplace-dataset-sccs
