ID,Name,Description,ColumnSpec,category,type,unit,source_comment,changes,comment,Contribution_ID
SCCS808,Use of multiple informants to collect data on child rearing,"Rohner, R. P., Berg, D. S., & Rohner, E. C. (1982). Data quality control in the standard cross-cultural sample: cross-cultural codes. Ethnology, 21(4), 359-369.",,"Childhood, Data Quality, Life cycle",Categorical,,rohner1982data,,Note: missing data entries could not be clearly distinguished from cases where the verification efforts identified by the codes were not used.,dplace-dataset-sccs
SCCS809,"Use of tests (e.g., Rorschach, TAT, sentence completion, I.Q.)","Rohner, R. P., Berg, D. S., & Rohner, E. C. (1982). Data quality control in the standard cross-cultural sample: cross-cultural codes. Ethnology, 21(4), 359-369.",,"Childhood, Data Quality, Life cycle",Categorical,,rohner1982data,,Note: missing data entries could not be clearly distinguished from cases where the verification efforts identified by the codes were not used.,dplace-dataset-sccs
SCCS810,Other verification efforts,"Rohner, R. P., Berg, D. S., & Rohner, E. C. (1982). Data quality control in the standard cross-cultural sample: cross-cultural codes. Ethnology, 21(4), 359-369.",,"Childhood, Data Quality, Life cycle",Categorical,,rohner1982data,,Note: missing data entries could not be clearly distinguished from cases where the verification efforts identified by the codes were not used.,dplace-dataset-sccs
SCCS811,Number of verification efforts,"Rohner, R. P., Berg, D. S., & Rohner, E. C. (1982). Data quality control in the standard cross-cultural sample: cross-cultural codes. Ethnology, 21(4), 359-369.",,"Childhood, Data Quality, Life cycle",Ordinal,number (integer),rohner1982data,,Note: missing data entries could not be clearly distinguished from cases where the verification efforts identified by the codes were not used.,dplace-dataset-sccs
SCCS812,Language familiarity,"Rohner, R. P., Berg, D. S., & Rohner, E. C. (1982). Data quality control in the standard cross-cultural sample: cross-cultural codes. Ethnology, 21(4), 359-369.",,"Childhood, Data Quality, Life cycle",Ordinal,,rohner1982data,,,dplace-dataset-sccs
SCCS813,Community involvement,"Rohner, R. P., Berg, D. S., & Rohner, E. C. (1982). Data quality control in the standard cross-cultural sample: cross-cultural codes. Ethnology, 21(4), 359-369.",,"Childhood, Data Quality, Life cycle",Ordinal,,rohner1982data,,,dplace-dataset-sccs
SCCS814,Percent Importance of Agriculture in Contribution to Subsistence and Trade,"Percent Importance in Contribution to Subsistence and Trade Computed indirectly from variables 3, 5, 7, 9, 11, and 1.

Barry, H., & Schlegel, A. (1982). Cross-cultural codes on contributions by women to subsistence. Ethnology, 21(2), 165-188.",,"Data Quality, Gender",Ordinal,,barry1982cross,,,dplace-dataset-sccs
SCCS815,Percent Importance of Domestic Animals in Contribution to Subsistence and Trade,"Barry, H., & Schlegel, A. (1982). Cross-cultural codes on contributions by women to subsistence. Ethnology, 21(2), 165-188.",,"Data Quality, Gender",Ordinal,,barry1982cross,,,dplace-dataset-sccs
SCCS816,Percent Importance of Fishing in Contribution to Subsistence and Trade,"Barry, H., & Schlegel, A. (1982). Cross-cultural codes on contributions by women to subsistence. Ethnology, 21(2), 165-188.",,"Data Quality, Gender",Ordinal,,barry1982cross,,,dplace-dataset-sccs
SCCS817,Percent Importance of Hunting in Contribution to Subsistence and Trade,"Barry, H., & Schlegel, A. (1982). Cross-cultural codes on contributions by women to subsistence. Ethnology, 21(2), 165-188.",,"Data Quality, Gender",Ordinal,,barry1982cross,,,dplace-dataset-sccs
SCCS818,Percent Importance of Gathering in Contribution to Subsistence and Trade,"Barry, H., & Schlegel, A. (1982). Cross-cultural codes on contributions by women to subsistence. Ethnology, 21(2), 165-188.",,"Data Quality, Gender",Ordinal,,barry1982cross,,,dplace-dataset-sccs
SCCS819,Percent Importance of Trade in Contribution to Subsistence [and Trade],"Barry, H., & Schlegel, A. (1982). Cross-cultural codes on contributions by women to subsistence. Ethnology, 21(2), 165-188.",,"Data Quality, Gender",Ordinal,,barry1982cross,,,dplace-dataset-sccs
SCCS820,Principal Subsistence Category,"Barry, H., & Schlegel, A. (1982). Cross-cultural codes on contributions by women to subsistence. Ethnology, 21(2), 165-188.",,"Data Quality, Gender",Categorical,categorical,barry1982cross,,,dplace-dataset-sccs
SCCS821,Percent Female Contribution to Agriculture,"Percent Female Contribution to Subsistence Tasks computed indirectly from the variables 108-112 (agriculture), 113-115 (domestic animals), 101, 104, 107 (Fishing), 103, 105, 106 (Hunting), and 99, 100, 102 (Gathering)

Barry, H., & Schlegel, A. (1982). Cross-cultural codes on contributions by women to subsistence. Ethnology, 21(2), 165-188.","{""datatype"": ""decimal""}","Data Quality, Gender",Continuous,percent,barry1982cross,,,dplace-dataset-sccs
SCCS822,Percent Female Contribution to Domestic Animals,"Barry, H., & Schlegel, A. (1982). Cross-cultural codes on contributions by women to subsistence. Ethnology, 21(2), 165-188.","{""datatype"": ""decimal""}","Data Quality, Gender",Continuous,percent,barry1982cross,,,dplace-dataset-sccs
SCCS823,Percent Female Contribution to Fishing,"Barry, H., & Schlegel, A. (1982). Cross-cultural codes on contributions by women to subsistence. Ethnology, 21(2), 165-188.","{""datatype"": ""decimal""}","Data Quality, Gender",Continuous,percent,barry1982cross,,,dplace-dataset-sccs
SCCS824,Percent Female Contribution to Hunting,"Barry, H., & Schlegel, A. (1982). Cross-cultural codes on contributions by women to subsistence. Ethnology, 21(2), 165-188.","{""datatype"": ""decimal""}","Data Quality, Gender",Continuous,percent,barry1982cross,,,dplace-dataset-sccs
SCCS825,Percent Female Contribution to Gathering,"Barry, H., & Schlegel, A. (1982). Cross-cultural codes on contributions by women to subsistence. Ethnology, 21(2), 165-188.","{""datatype"": ""decimal""}","Data Quality, Gender",Continuous,percent,barry1982cross,,,dplace-dataset-sccs
SCCS826,Average Female Contribution to Subsistence,"Barry, H., & Schlegel, A. (1982). Cross-cultural codes on contributions by women to subsistence. Ethnology, 21(2), 165-188.","{""datatype"": ""decimal""}","Data Quality, Gender",Continuous,percent,barry1982cross,,"Percentages, Computed from Weighted Sum of Variables: (814x821 + 815x822 + 816x823 + 817x824 + 818x825)/(100-819). This differs from Barry's calculations by at most 1%. Two additional societies are coded with 50% or more trade dependence. (note source: DRW codebook)",dplace-dataset-sccs
SCCS827,Sexual Expression in Adolescent Boys,"Encouragement of sexual behavior, taking into account its frequency, emotional intensity, importance, and variety (including range of partners) in adolescence. Heterosexual intercourse is the principal criterion, but heterosexual foreplay, masturbation, homosexuality, sexual jokes, and exposing the genitals were also considered.

Barry, H., & Schlegel, A. (1984). Measurements of adolescent sexual behavior in the standard sample of societies. Ethnology, 23(4), 315-329.",,"Childhood, Life cycle",Ordinal,,barry1984measurements,,,dplace-dataset-sccs
SCCS828,Sexual Expression in Adolescent Girls,"Barry, H., & Schlegel, A. (1984). Measurements of adolescent sexual behavior in the standard sample of societies. Ethnology, 23(4), 315-329.",,"Childhood, Life cycle",Ordinal,,barry1984measurements,,,dplace-dataset-sccs
SCCS829,Sexual Nonrestraint in Adolescent Boys,"The absence of sexual restraints such as taboos or restrictions on heterosexual intercourse and other erotic behavior, including heterosexual play, masturbation, and homosexuality. A high degree of modesty, such as the requirement to keep the genitals constantly covered in public, indicates moderate restraint. Incest taboos, if highly emphasized or widely extended, are considered as indicators of restraint. Note: Sexual nonrestraint = Sexual expression + 1 more or less. The authors indicate the advisability of using the sum of the two scores as a Sexual Freedom index.

Barry, H., & Schlegel, A. (1984). Measurements of adolescent sexual behavior in the standard sample of societies. Ethnology, 23(4), 315-329.",,"Childhood, Life cycle",Ordinal,,barry1984measurements,,,dplace-dataset-sccs
SCCS830,Sexual Nonrestraint in Adolescent Girls,"Barry, H., & Schlegel, A. (1984). Measurements of adolescent sexual behavior in the standard sample of societies. Ethnology, 23(4), 315-329.",,"Childhood, Life cycle",Ordinal,,barry1984measurements,,,dplace-dataset-sccs
SCCS831,Differentiation of Adolescence from Childhood for Boys,"Differentiation of adolescent from preadolescent activities, status, and all other attributes of behavior and self-concept

Barry, H., & Schlegel, A. (1984). Measurements of adolescent sexual behavior in the standard sample of societies. Ethnology, 23(4), 315-329.",,"Childhood, Life cycle",Ordinal,,barry1984measurements,,,dplace-dataset-sccs
SCCS832,Differentiation of Adolescence from Childhood for Girls,"Barry, H., & Schlegel, A. (1984). Measurements of adolescent sexual behavior in the standard sample of societies. Ethnology, 23(4), 315-329.",,"Childhood, Life cycle",Ordinal,,barry1984measurements,,,dplace-dataset-sccs
SCCS833,Subsistence Economy: Dominant Mode,"Murdock, G. P. and White, D. R. (1969). Standard Cross-Cultural Sample. Ethnology 8: 329-369.",,"Economy, Subsistence",Categorical,,murdock1969standard,,,dplace-dataset-sccs
SCCS834,Subsistence Economy: Subsidiary Mode,"Murdock, G. P. and White, D. R. (1969). Standard Cross-Cultural Sample. Ethnology 8: 329-369.",,"Economy, Subsistence",Categorical,,murdock1969standard,,,dplace-dataset-sccs
SCCS835,Political Integration,"Murdock, G. P. and White, D. R. (1969). Standard Cross-Cultural Sample. Ethnology 8: 329-369.",,Politics,Ordinal,,murdock1969standard,,,dplace-dataset-sccs
SCCS836,Rule of Descent: Primary,"Murdock, G. P. and White, D. R. (1969). Standard Cross-Cultural Sample. Ethnology 8: 329-369.",,Kinship,Categorical,,murdock1969standard,,,dplace-dataset-sccs
SCCS837,Adequacy of HRAF File (in 1969),"Murdock, G. P. and White, D. R. (1969). Standard Cross-Cultural Sample. Ethnology 8: 329-369.",,Data Quality,Ordinal,,murdock1969standard,,,dplace-dataset-sccs
SCCS860,Cultural Basis of Polygyny,"White, D. R. (1986). Forms and frequencies of polygyny: Standard Sample codes. World Cultures 2(2).",,"Data Quality, Kinship, Marriage",Ordinal,,white1986forms,,,dplace-dataset-sccs
SCCS861,"Standard Polygamy Code: Whyte, Murdock and Wilson, Murdock Atlas","White, D. R. (1986). Forms and frequencies of polygyny: Standard Sample codes. World Cultures 2(2).",,"Data Quality, Kinship, Marriage",Ordinal,,white1986forms,,,dplace-dataset-sccs
SCCS862,Sororal Polygyny,"White, D. R. (1986). Forms and frequencies of polygyny: Standard Sample codes. World Cultures 2(2).",,"Data Quality, Kinship, Marriage",Categorical,,white1986forms,,"NOTE: There is sufficient information for an exclusively non-sororal category, see especially Murdock's Africa (1959). Probably also sufficient for sororal preferred but not predominant.",dplace-dataset-sccs
SCCS863,Distance between Co-wives,"White, D. R. (1986). Forms and frequencies of polygyny: Standard Sample codes. World Cultures 2(2).",,"Data Quality, Kinship, Marriage",Categorical,,white1986forms,,,dplace-dataset-sccs
SCCS864,Rooming Arrangement for Wives,"White, D. R. (1986). Forms and frequencies of polygyny: Standard Sample codes. World Cultures 2(2).",,"Data Quality, Kinship, Marriage",Categorical,,white1986forms,,,dplace-dataset-sccs
SCCS865,Rooming Arrangement for Husband,"White, D. R. (1986). Forms and frequencies of polygyny: Standard Sample codes. World Cultures 2(2).",,"Data Quality, Kinship, Marriage",Categorical,,white1986forms,,,dplace-dataset-sccs
SCCS866,"Higher Rates of Polygyny for Men of Wealth, Rank, Nobility, or Higher Social Class","White, D. R. (1986). Forms and frequencies of polygyny: Standard Sample codes. World Cultures 2(2).",,"Data Quality, Kinship, Marriage",Categorical,,white1986forms,,,dplace-dataset-sccs
SCCS867,Multiple Wives for Skilled Hunters,"White, D. R. (1986). Forms and frequencies of polygyny: Standard Sample codes. World Cultures 2(2).",,"Data Quality, Kinship, Marriage",Categorical,,white1986forms,,,dplace-dataset-sccs
SCCS868,"Multiple Wives for Leaders, Headmen, Chiefs","White, D. R. (1986). Forms and frequencies of polygyny: Standard Sample codes. World Cultures 2(2).",,"Data Quality, Kinship, Marriage",Categorical,,white1986forms,,,dplace-dataset-sccs
SCCS869,Multiple Wives for Medicine Men or Shamans,"White, D. R. (1986). Forms and frequencies of polygyny: Standard Sample codes. World Cultures 2(2).",,"Data Quality, Kinship, Marriage",Categorical,,white1986forms,,NOTE: sometimes coded 0 for General polygyny although magicians also polygynous - unclear whether higher polygyny level should be required in this instance for this code,dplace-dataset-sccs
SCCS870,Additional Wives or Concubines from Slavery or Capture in Warfare,"White, D. R. (1986). Forms and frequencies of polygyny: Standard Sample codes. World Cultures 2(2).",,"Data Quality, Kinship, Marriage",Categorical,,white1986forms,,"NOTE: It is often difficult to distinguish secondary wives taken as slave concubines, or marriage to freed slaves, and wives taken from capture in warfare, as slavery areas often capture slaves",dplace-dataset-sccs
SCCS871,Percentage of Married Men with More than One Wife,"White, D. R. (1986). Forms and frequencies of polygyny: Standard Sample codes. World Cultures 2(2).","{""datatype"": ""decimal""}","Data Quality, Kinship, Marriage",Continuous,percent,white1986forms,,,dplace-dataset-sccs
SCCS872,Percentage of Married Women Polygynously Married (Share Husband with One or More Co-wives),"White, D. R. (1986). Forms and frequencies of polygyny: Standard Sample codes. World Cultures 2(2).","{""datatype"": ""decimal""}","Data Quality, Kinship, Marriage",Continuous,percent,white1986forms,,,dplace-dataset-sccs
SCCS873,Reliability of Data for Percentage Polygynously Married,"White, D. R. (1986). Forms and frequencies of polygyny: Standard Sample codes. World Cultures 2(2).",,"Data Quality, Kinship, Marriage",Categorical,,white1986forms,,,dplace-dataset-sccs
SCCS874,Polygyny Data Source,"White, D. R. (1986). Forms and frequencies of polygyny: Standard Sample codes. World Cultures 2(2).",,"Data Quality, Kinship, Marriage",Categorical,,white1986forms,,,dplace-dataset-sccs
SCCS876,Polygyny Distributions,"White, D. R. (1986). Forms and frequencies of polygyny: Standard Sample codes. World Cultures 2(2).",,"Data Quality, Kinship, Marriage",Categorical,,white1986forms,,,dplace-dataset-sccs
SCCS877,Polygyny Guttman Scale I: Co-wife Autonomy Constructed from 854-852,"White, D. R. (1986). Forms and frequencies of polygyny: Standard Sample codes. World Cultures 2(2).",,"Data Quality, Kinship, Marriage",Categorical,,white1986forms,,,dplace-dataset-sccs
SCCS878,Polygyny Guttman Scale II: Charismatic Constructed from 851-855,"White, D. R. (1986). Forms and frequencies of polygyny: Standard Sample codes. World Cultures 2(2).",,"Data Quality, Kinship, Marriage",Categorical,,white1986forms,,,dplace-dataset-sccs
SCCS879,Shaman,"Winkelman, M. J. (1984). A cross-cultural study of magico-religious practitioners (Doctoral dissertation, University of California, Irvine).",,"Health, Ritual",Categorical,,winkelman1984cross,,"Samples every 4th society in the Standard Sample (1, 5, 9, ...), but societies 9 and 185 have insufficient data to code; 2 added",dplace-dataset-sccs
SCCS880,Shaman/Healer,"Winkelman, M. J. (1984). A cross-cultural study of magico-religious practitioners (Doctoral dissertation, University of California, Irvine).",,"Health, Ritual",Categorical,,winkelman1984cross,,,dplace-dataset-sccs
SCCS881,Healer,"Winkelman, M. J. (1984). A cross-cultural study of magico-religious practitioners (Doctoral dissertation, University of California, Irvine).",,"Health, Ritual",Categorical,,winkelman1984cross,,,dplace-dataset-sccs
SCCS882,Medium,"Winkelman, M. J. (1984). A cross-cultural study of magico-religious practitioners (Doctoral dissertation, University of California, Irvine).",,"Health, Ritual",Categorical,,winkelman1984cross,,,dplace-dataset-sccs
SCCS883,Sorcerer/Witch,"Winkelman, M. J. (1984). A cross-cultural study of magico-religious practitioners (Doctoral dissertation, University of California, Irvine).",,"Health, Ritual",Categorical,,winkelman1984cross,,,dplace-dataset-sccs
SCCS884,Priest,"Winkelman, M. J. (1984). A cross-cultural study of magico-religious practitioners (Doctoral dissertation, University of California, Irvine).",,"Health, Ritual",Categorical,,winkelman1984cross,,,dplace-dataset-sccs
SCCS885,Female Contribution to Subsistence (percent): Ethnographic Atlas,"White, D. R. (1989). Female contribution to subsistence: measurement and reliability. World Cultures.","{""datatype"": ""decimal""}","Gender, Subsistence",Continuous,percent,white1989female,,,dplace-dataset-sccs
SCCS886,Female Contribution to Subsistence (percent): Martin Whyte,"White, D. R. (1989). Female contribution to subsistence: measurement and reliability. World Cultures.","{""datatype"": ""decimal""}","Gender, Subsistence",Continuous,percent,white1989female,,,dplace-dataset-sccs
SCCS887,Female Contribution to Subsistence (percent): Martin Whyte,"White, D. R. (1989). Female contribution to subsistence: measurement and reliability. World Cultures.","{""datatype"": ""decimal""}","Gender, Subsistence",Continuous,percent,white1989female,,,dplace-dataset-sccs
SCCS888,Female Contribution to Subsistence (percent): Martin Whyte,"White, D. R. (1989). Female contribution to subsistence: measurement and reliability. World Cultures.","{""datatype"": ""decimal""}","Gender, Subsistence",Continuous,percent,white1989female,,,dplace-dataset-sccs
SCCS889,Female Contribution to Subsistence (percent): Martin Whyte,"White, D. R. (1989). Female contribution to subsistence: measurement and reliability. World Cultures.","{""datatype"": ""decimal""}","Gender, Subsistence",Continuous,percent,white1989female,,,dplace-dataset-sccs
SCCS890,Female Contribution to Subsistence: Average of Three Scores (Ordinated),"White, D. R. (1989). Female contribution to subsistence: measurement and reliability. World Cultures.",,"Gender, Subsistence",Ordinal,,white1989female,,,dplace-dataset-sccs
SCCS891,"Frequency of Internal War Otterbein (1970: 3, 84, 143) Definition of Internal War","Otterbein's (1970: 3, 84, 143) definition of internal war excludes feuding: warfare between political communities within the cultural unit, i.e., continguous political communities that are culturally similar. p. 3: Warfare is defined as armed combat between political communities. Armed combat, which is fighting with weapons, is performed by military organizations. When political communities within the same cultural unit engage in warfare, this is considered to be internal war. p. 143: If there is more than one military organization within a political community, and these ... engage in armed combat, this is considered feuding or civil war, depending on the scope of the conflict. (note source: DRW codebook)

Nammour, V. W. (1974). Drums And Guns: A Cross-cultural Study Of The Nature Of War. (Doctoral Dissertation, University of Oregon). ",,"Politics, Warfare",Ordinal,,nammour1974drums,,"DW NOTE: (Var Label Reversed). Another note in DW codebook says: References cited: Naroll, Raoul. 1966. Does military deterrence deter? Trans-Action 3(2): 14-20. and Otterbein, Keith F. 1970. The Evolution of War: A Cross-cultural study. HRAF Press.",dplace-dataset-sccs
SCCS892,"Frequency of External War - Attacking [follows Otterbein 1970: 84, 143-144]","Nammour, V. W. (1974). Drums And Guns: A Cross-cultural Study Of The Nature Of War. (Doctoral Dissertation, University of Oregon). ",,"Politics, Warfare",Ordinal,,nammour1974drums,,(Var Label Reversed) (note source: DRW codebook),dplace-dataset-sccs
SCCS893,"Frequency of External War - Being Attacked [follows Otterbein 1970: 84, 143-144]","Nammour, V. W. (1974). Drums And Guns: A Cross-cultural Study Of The Nature Of War. (Doctoral Dissertation, University of Oregon). ",,"Politics, Warfare",Ordinal,,nammour1974drums,,(Var Label Reversed) (note source: DRW codebook),dplace-dataset-sccs
SCCS894,Form of Military Mobilization [adapted from Otterbein 1970: 144],"Nammour, V. W. (1974). Drums And Guns: A Cross-cultural Study Of The Nature Of War. (Doctoral Dissertation, University of Oregon). ",,"Politics, Warfare",Categorical,,nammour1974drums,,(Var Label Reversed) (note source: DRW codebook),dplace-dataset-sccs
SCCS895,"Decision to Engage in War [follows Otterbein 1970: 28-29, 144]","Nammour, V. W. (1974). Drums And Guns: A Cross-cultural Study Of The Nature Of War. (Doctoral Dissertation, University of Oregon). ",,"Politics, Warfare",Categorical,,nammour1974drums,,,dplace-dataset-sccs
SCCS896,"Commencement of War [follows Otterbein 1970: 32, 144]","Nammour, V. W. (1974). Drums And Guns: A Cross-cultural Study Of The Nature Of War. (Doctoral Dissertation, University of Oregon). ",,"Politics, Warfare",Categorical,,nammour1974drums,,,dplace-dataset-sccs
SCCS897,"Conclusion of War [follows Otterbein 1970: 35, 144]","Nammour, V. W. (1974). Drums And Guns: A Cross-cultural Study Of The Nature Of War. (Doctoral Dissertation, University of Oregon). ",,"Politics, Warfare",Categorical,,nammour1974drums,,,dplace-dataset-sccs
SCCS898,Peace Ceremony,"Nammour, V. W. (1974). Drums And Guns: A Cross-cultural Study Of The Nature Of War. (Doctoral Dissertation, University of Oregon). ",,"Politics, Warfare",Categorical,,nammour1974drums,,(Var Label Reversed) (note source: DRW codebook),dplace-dataset-sccs
SCCS899,"Military Expectations I-pre-state [follows Naroll L966, with Modifications by Otterbein 1970]","Nammour, V. W. (1974). Drums And Guns: A Cross-cultural Study Of The Nature Of War. (Doctoral Dissertation, University of Oregon). ",,"Politics, Warfare",Ordinal,,nammour1974drums,,(Var Label Reversed) (note source: DRW codebook),dplace-dataset-sccs
SCCS900,Military Expectations II-state,"Nammour, V. W. (1974). Drums And Guns: A Cross-cultural Study Of The Nature Of War. (Doctoral Dissertation, University of Oregon). ",,"Politics, Warfare",Ordinal,,nammour1974drums,,(Var Label Reversed) (note source: DRW codebook),dplace-dataset-sccs
SCCS901,"Casualty Rate Poor Correlation with Ember 2005 Male Mortality in War [follows Otterbein 1970: 81, 146]","Nammour, V. W. (1974). Drums And Guns: A Cross-cultural Study Of The Nature Of War. (Doctoral Dissertation, University of Oregon). ",,"Politics, Warfare",Ordinal,,nammour1974drums,,(Var Label Reversed) This has turned out to be a difficult variable to code; information does not exist in most cases. Wheeler l974:270 (note source: DRW codebook),dplace-dataset-sccs
SCCS902,"Leadership during Battle [modified from Otterbein 1970: 23-28, 144]","Nammour, V. W. (1974). Drums And Guns: A Cross-cultural Study Of The Nature Of War. (Doctoral Dissertation, University of Oregon). ",,"Politics, Warfare",Categorical,,nammour1974drums,,"When I drew up this variable, I neglected to allow for those cases where a leader has an official position -- appointed war chief, hereditary war chief -- and is very aware of the honor and respect of this office but still has no means to force followers to obey. His formality may be hollow if people choose to disregard his direction. Wheeler l974:272 (note source: DRW codebook)",dplace-dataset-sccs
SCCS903,Prestige Associated with Being a Soldier or Warrior,"Nammour, V. W. (1974). Drums And Guns: A Cross-cultural Study Of The Nature Of War. (Doctoral Dissertation, University of Oregon). ",,"Politics, Warfare",Categorical,,nammour1974drums,,(Var Label Reversed) (note source: DRW codebook),dplace-dataset-sccs
SCCS904,Cowardice: Defined As,"Nammour, V. W. (1974). Drums And Guns: A Cross-cultural Study Of The Nature Of War. (Doctoral Dissertation, University of Oregon). ",,"Politics, Warfare",Categorical,,nammour1974drums,,"This variable is a failure, but for an interesting reason. With very few exceptions, even including professionally trained ethnographers, observers simply do not state what action brings down an accusation of cowardice. Cowardice is often mentioned, but not what it is seen to be. Wheeler 1974: 273. (note source: DRW codebook)",dplace-dataset-sccs
SCCS905,"Rewards (Special Gifts, Praises, or Ceremonies, Not including Ritual Purification for a Man Who Has Killed an Enemy in Battle or Otherwise Shown Skill in War)","Nammour, V. W. (1974). Drums And Guns: A Cross-cultural Study Of The Nature Of War. (Doctoral Dissertation, University of Oregon). ",,"Politics, Warfare",Categorical,,nammour1974drums,,(Var Label Reversed) This variable augments variable [903] Wheeler l974:273 (note source: DRW codebook),dplace-dataset-sccs
SCCS906,Did Members of the Society Expect Violence to Solve Their Problems?,"Nammour, V. W. (1974). Drums And Guns: A Cross-cultural Study Of The Nature Of War. (Doctoral Dissertation, University of Oregon). ",,"Politics, Warfare",Categorical,,nammour1974drums,,"(Var Label Reversed) My operationalization of this variable breaks all the methodological rules and consequently is vulnerable to attack... the coder has used his assessment of the material overall.... I think the variable is enormously important, and eventually I hope to build some rigor ... into it. Wheeler l974:274-5. (note source: DRW codebook)",dplace-dataset-sccs
